state_name,state_name_slug,state_code,state_code_slug,district,at_large,vacant,bioguide,thomas,govtrack,opensecrets,votesmart,fec,maplight,wikidata,google_entity_id,title,party,name,name_slug,first_name,middle_name,last_name,name_suffix,goes_by,pronunciation,gender,ethnicity,religion,openly_lgbtq,date_of_birth,entered_office,term_end,biography,phone,fax,latitude,longitude,address_complete,address_number,address_prefix,address_street,address_sec_unit_type,address_sec_unit_num,address_city,address_state,address_zipcode,address_type,website,contact_page,facebook_url,twitter_handle,twitter_url,photo_url
"Missouri","missouri","MO","mo","8","false","false","S001195","2191","412596","N00035282","59318","H4MO08162","2047","Q6163589","kg:/m/0g9yj_2","representative","republican","Jason Smith","jason-smith","Jason",,"Smith",,,"JAY-suhn SMITH","male","white-american","pentecostal","no","1980-06-16","2013-06-04","2019-01-03","Jason Smith, a Representative from Missouri; born in St. Louis, Mo., on June 16, 1980; graduated from Salem High School, Salem, Mo., 1998; B.S., University of Missouri, Columbia, Mo., 2001; J.D., Oklahoma City University School of Law, Oklahoma City, Oklahoma, 2004; farmer; lawyer, private practice; member of the Missouri state house of representatives, 2005-2013; elected as a Republican to the One Hundred Thirteenth Congress, by special election, to fill the vacancy caused by the resignation of United States Representative Jo Ann Emerson, and reelected to the two succeeding Congresses (June 4, 2013-present).","202-225-4404","573-335-1931","38.8863235","-77.011373","2436 Rayburn Hob, Washington, DC 20515","2436",,"Rayburn Hob",,,"Washington","DC","20515",,"https://jasonsmith.house.gov","http://jasonsmith.house.gov/contact/email-jason","https://www.facebook.com/repjasonsmith/","RepJasonSmith","https://twitter.com/RepJasonSmith","https://cdn.civil.services/us-house/headshots/512x512/jason-smith.jpg"
"Mississippi","mississippi","MS","ms","1","false","false","K000388","2294","412673","N00037003","156389","H6MS01131","2163","Q20204915","kg:/m/013b9qgh","representative","republican","Trent Kelly","trent-kelly","Trent",,"Kelly",,,"CHRENT KELL-ee","male","white-american","methodist","no","1966-03-01","2015-06-09","2019-01-03","Trent Kelly, a Representative from Mississippi; born March 1, 1966, Union, Union County, Miss.; graduated from Union High School, Union, Miss., 1984; A.A., East Central Community College, Decatur, Miss., 1986; B.A., University of Mississippi, University, Miss., 1989; J.D., University of Mississippi, Oxford, Miss., 1994; M.A., United States Army War College, Carlisle, Penn., 2010; United States Army National Guard; lawyer, private practice; prosecutor, Tupelo, Miss., 1999-2011; district attorney, 2012-2015; elected as a Republican to the One Hundred Fourteenth Congress, by special election, to fill the vacancy caused by the death of United States Representative Alan Nunnelee, and reelected to the succeeding Congress (June 2, 2015-present).","202-225-4306","202-225-3549","38.8863235","-77.011373","2436 Rayburn Hob, Washington, DC 20515","2436",,"Rayburn Hob",,,"Washington","DC","20515",,"https://trentkelly.house.gov","http://trentkelly.house.gov/contact/","https://www.facebook.com/RepTrentKelly/",,,"https://cdn.civil.services/us-house/headshots/512x512/trent-kelly.jpg"
"Mississippi","mississippi","MS","ms","2","false","false","T000193","1151","400402","N00003288","26929","H4MS02068","490","Q817877","kg:/m/033tc5","representative","democrat","Bennie Thompson","bennie-thompson","Bennie","G.","Thompson",,,"BIN-ee TAHM-suhn","male","african-american","methodist","no","1948-01-28","1993-04-13","2019-01-03","Bennie Thompson, a Representative from Mississippi; born in Bolton, Hinds County, Miss., January 28, 1948; B.A., Tougaloo College, Tougaloo, Miss., 1968; M.S., Jackson State University, Jackson, Miss., 1972; teacher; member of the Bolton, Miss., board of aldermen, 1969-1973; Mayor of Bolton, Miss., 1973-1979; member of the Hinds County, Miss., board of supervisors, 1980-1993; elected as a Democrat to the One Hundred Third Congress, by special election, to fill the vacancy caused by the resignation of United States Representative Alphonso Michael (Mike) Espy, and reelected to the twelve succeeding Congresses (April 13, 1993-present); chair, Committee on Homeland Security (One Hundred Tenth and One Hundred Eleventh Congresses).","202-225-5876",,"38.8863235","-77.011373","2436 Rayburn Hob, Washington, DC 20515","2436",,"Rayburn Hob",,,"Washington","DC","20515",,,,"https://www.facebook.com/CongressmanBennieGThompson/","BennieGThompson","https://twitter.com/BennieGThompson","https://cdn.civil.services/us-house/headshots/512x512/bennie-thompson.jpg"
"Mississippi","mississippi","MS","ms","3","false","false","H001045","1933","412280","N00029632","101985","H8MS03067","762","Q1545023","kg:/m/0406s7r","representative","republican","Gregg Harper","gregg-harper","Gregg",,"Harper",,,"GREGG HAR-per","male","white-american","southern-baptist","no","1956-06-01","2009-01-06","2019-01-03","Gregg Harper, a Representative from Mississippi; born in Jackson, Hinds County, Miss., June 1, 1956; graduated from Pearl High School, Pearl, Miss., 1974; B.S., Mississippi College, Clinton, Miss., 1978; J.D., University of Mississippi, Oxford, Miss., 1981; lawyer, private practice; prosecutor, Brandon, Miss.; prosecutor, Richland, Miss.; chairman, Rankin County, Miss. Republican Party, 2000-2007; elected as a Republican to the One Hundred Eleventh and to the four succeeding Congresses (January 3, 2009-present); chair, Joint Committee on the Library of Congress (One Hundred Thirteenth Congress); chair, Joint Committee on Printing (One Hundred Fourteenth Congress); chair, Committee on House Administration (One Hundred Fifteenth Congress).","202-225-5031","202-225-5797","38.8863235","-77.011373","2436 Rayburn Hob, Washington, DC 20515","2436",,"Rayburn Hob",,,"Washington","DC","20515",,"https://harper.house.gov","http://harper.house.gov/contact-gregg/email-gregg","https://www.facebook.com/GreggHarper/","GreggHarper","https://twitter.com/GreggHarper","https://cdn.civil.services/us-house/headshots/512x512/gregg-harper.jpg"
"Mississippi","mississippi","MS","ms","4","false","false","P000601","2035","412443","N00031958","69521","H0MS04120","1453","Q24230","kg:/m/0c3y_s5","representative","republican","Steven Palazzo","steven-palazzo","Steven",,"Palazzo",,,"STEEV-in puh-LAZZ-oh","male","white-american","roman-catholic","no","1970-02-21","2011-01-05","2019-01-03","Steven Palazzo, a Representative from Mississippi; born in Gulfport, Harrison County, Miss., February 21, 1970; graduated from Saint John High School, Gulfport, Miss., 1988; B.S., University of Southern Mississippi, Hattiesburg, Miss., 1994; M.P.A., University of Southern Mississippi, Hattiesburg, Miss., 1996; United States Marine Corps Reserve, 1988-1996; Mississippi Army National Guard, 2007-present; accountant; member of the Mississippi state house of representatives, 2007-2010; elected as a Republican to the One Hundred Twelfth and to the three succeeding Congresses (January 3, 2011-present).","202-225-5772","228-864-3099","38.8863235","-77.011373","2436 Rayburn Hob, Washington, DC 20515","2436",,"Rayburn Hob",,,"Washington","DC","20515",,"https://palazzo.house.gov","http://palazzo.house.gov/contact/","https://www.facebook.com/stevenpalazzo/","CongPalazzo","https://twitter.com/CongPalazzo","https://cdn.civil.services/us-house/headshots/512x512/steven-palazzo.jpg"
"Montana","montana","MT","mt",,"true","false","Z000018","2254","412640","N00035616",,"H4MT01041","2096","Q7384672","kg:/m/0gkz1jg","representative","republican","Ryan Zinke","ryan-zinke","Ryan",,"Zinke",,,"RAHY-uhn ZIN-kee","male","white-american","evangelical-lutheran","no","1961-11-01","2015-01-06","2019-01-03","Ryan Zinke, a Representative from Montana; born in Bozeman, Gallatin County, Mont., November 1, 1961; graduated from Whitefish High School, Whitefish, Mont., 1980; B.S., University of Oregon, Eugene, Ore., 1984; M.B.A., National University, San Diego, Calif., 1991; M.S., University of San Diego, San Diego, Calif., 2003; United States Navy, 1985-2008; business executive; member of the Montana state senate, 2009-2012; unsuccessful candidate for nomination for lieutenant governor of Montana in 2012; elected as a Republican to the One Hundred Fourteenth and to the succeeding Congress (January 3, 2015-present).","202-225-3211","202-225-5687","38.8863235","-77.011373","2436 Rayburn Hob, Washington, DC 20515","2436",,"Rayburn Hob",,,"Washington","DC","20515",,"https://zinke.house.gov","https://zinke.house.gov/contact/email","https://www.facebook.com/CongressmanRyanZinke/","RepRyanZinke","https://twitter.com/RepRyanZinke","https://cdn.civil.services/us-house/headshots/512x512/ryan-zinke.jpg"
"North Carolina","north-carolina","NC","nc","1","false","false","B001251","1761","400616","N00027035","41077","H4NC01046","624","Q983532","kg:/m/03g_pq","representative","democrat","G.K. Butterfield","gk-butterfield","G.K.",,"Butterfield",,,"JEE-kay BUH-ter-feel","male","african-american","baptist","no","1947-04-27","2004-07-21","2019-01-03","G.K. Butterfield, a Representative from North Carolina; born in Wilson, Wilson County, N.C., April 27, 1947; graduated from Charles H. Darden High School, Wilson, N.C.; B.A., North Carolina Central University, Durham, N.C., 1971; J.D., North Carolina Central University School of Law, 1974; United States Army, 1968-1970; lawyer, private practice; North Carolina resident superior court judge, 1989-2001; North Carolina special superior court judge, 2002-2004; justice of the North Carolina state supreme court, 2001-2002; elected as a Democrat to the One Hundred Eighth Congress, by special election, to fill the vacancy caused by the resignation of United States Representative Frank Ballance, and reelected to the seven succeeding Congresses (July 20, 2004-present).","202-225-3101","202-225-3101","38.8863235","-77.011373","2436 Rayburn Hob, Washington, DC 20515","2436",,"Rayburn Hob",,,"Washington","DC","20515",,"https://butterfield.house.gov","https://butterfield.house.gov/contact/email-me","https://www.facebook.com/congressmangkbutterfield","GKButterfield","https://twitter.com/GKButterfield","https://cdn.civil.services/us-house/headshots/512x512/gk-butterfield.jpg"
"North Carolina","north-carolina","NC","nc","2","false","false","H001065","2143","412553","N00033399","136462","H2NC13110","1777","Q3956828","kg:/m/0hgp6py","representative","republican","George Holding","george-holding","George",,"Holding",,,"JORJ HOLE-ding","male","white-american","southern-baptist","no","1968-04-17","2013-01-03","2019-01-03","George Holding, a Representative from North Carolina; born in Raleigh, Wake County, N.C., April 17, 1968; B.A., Wake Forest University, Winston-Salem, N.C.; J.D., Wake Forest University, Winston-Salem, N.C., 1996; lawyer, private practice; staff, United States Senator Jesse Helms of North Carolina, 1998-2002; assistant United States attorney, Eastern District of North Carolina, 2002-2006; United States attorney, Eastern District of North Carolina, 2006-2011; elected as a Republican to the One Hundred Thirteenth and to the two succeeding Congresses (January 3, 2013-present).","202-225-4531","919-782-4490","38.8863235","-77.011373","2436 Rayburn Hob, Washington, DC 20515","2436",,"Rayburn Hob",,,"Washington","DC","20515",,"https://holding.house.gov","https://holding.house.gov/contact/","https://www.facebook.com/CongressmanGeorgeHolding","RepReneeEllmers","https://twitter.com/RepReneeEllmers","https://cdn.civil.services/us-house/headshots/512x512/george-holding.jpg"
"North Carolina","north-carolina","NC","nc","3","false","false","J000255","612","400209","N00002299","21785","H2NC01081","309","Q512537","kg:/m/03g_r5","representative","republican","Walter Jones","walter-jones","Walter","B.","Jones",,,"WAWL-tuh JOHNZ","male","white-american","roman-catholic","no","1943-02-10","1995-01-04","2019-01-03","Walter Jones, (son of Walter Beaman Jones, Sr.), a Representative from North Carolina; born in Farmville, Pitt County, N.C., February 10, 1943; graduated from Hargrave Military Academy, Chatham, Va., 1961; B.A., Atlantic Christian College (now Barton College), Wilson, N.C., 1966; North Carolina National Guard, 1967-1971; member of the North Carolina state house of representatives, 1983-1992; unsuccessful candidate for nomination to the One Hundred Third Congress in 1992; elected as a Republican to the One Hundred Fourth and to the eleven succeeding Congresses (January 3, 1995-present).","202-225-3415","252-931-1002","38.8863235","-77.011373","2436 Rayburn Hob, Washington, DC 20515","2436",,"Rayburn Hob",,,"Washington","DC","20515",,"https://jones.house.gov","https://jones.house.gov/contact-me/email-me","https://www.facebook.com/Walter-Jones-15083070102","RepWalterJones","https://twitter.com/RepWalterJones","https://cdn.civil.services/us-house/headshots/512x512/walter-jones.jpg"
"North Carolina","north-carolina","NC","nc","4","false","false","P000523","930","400326","N00002260","119","H6NC04037","420","Q984010","kg:/m/034dxn","representative","democrat","David Price","david-price","David",,"Price",,,"DAY-vid PRICE","male","white-american","baptist","no","1940-08-17","1987-01-06","2019-01-03","David Price, a Representative from North Carolina; born in Erwin, Unicoi County, Tenn., August 17, 1940; graduated from Unicoi County High School, Erwin, Tenn., 1957; attended Mars Hill College, Mars Hill, N.C., 1957-1959; B.A., University of North Carolina, Chapel Hill, N.C., 1961; B.D., Yale University, New Haven, Conn., 1964; Ph.D., Yale University, New Haven, Conn., 1969; faculty, Yale University, New Haven, Conn., 1967-1973; staff, United States Senator Edward Lewis Bartlett of Alaska, 1963-1967; professor, Duke University, Durham, N.C., 1973-1986 and 1995-1996; staff director, commission on presidential nomination, Democratic National Committee, 1981-1982; chairman, North Carolina Democratic Party, 1983-1984; elected as a Democrat to the One Hundredth and to the three succeeding Congresses (January 3, 1987-January 3, 1995); unsuccessful candidate for reelection to the One Hundred Fourth Congress in 1994; elected as a Democrat to the One Hundred Fifth and to the ten succeeding Congresses (January 3, 1997-present).","202-225-1784","202.225.2014","38.8863235","-77.011373","2436 Rayburn Hob, Washington, DC 20515","2436",,"Rayburn Hob",,,"Washington","DC","20515",,"https://priceforms.house.gov","https://priceforms.house.gov/contact/",,"RepDavidEPrice","https://twitter.com/RepDavidEPrice","https://cdn.civil.services/us-house/headshots/512x512/david-price.jpg"
"North Carolina","north-carolina","NC","nc","5","false","false","F000450","1791","400643","N00026166","6051","H4NC05146","649","Q458453","kg:/m/02b5dz","representative","republican","Virginia Foxx","virginia-foxx","Virginia",,"Foxx",,,"ver-JIN-yuh FAHKS","female","white-american","roman-catholic","no","1943-06-29","2005-01-04","2019-01-03","Virginia Foxx, a Representative from North Carolina; born in New York, New York County, N.Y., June 29, 1943; graduated from Crossnore High School, Crossnore, N.C., 1961; A.B., University of North Carolina, Chapel Hill, N.C., 1968; M.A.C.T., University of North Carolina, Chapel Hill, N.C., 1972; Ed.D., University of North Carolina, Greensboro, N.C., 1985; instructor, Caldwell Community College, Hudson, N.C.; instructor, Appalachian State University, Boone, N.C.; assistant dean, Appalachian State University, Boone, N.C.; president, Mayland Community College, Spruce Pine, N.C., 1987-1994; landscape nursery owner; deputy secretary for management, North Carolina Department of Administration; member of the Watauga County, N.C., board of education, 1976-1988; member of the North Carolina state senate, 1994-2004; elected as a Republican to the One Hundred Ninth and to the six succeeding Congresses (January 3, 2005-present); chair, Committee on Education & the Workforce (One Hundred Fifteenth Congress).","202-225-2071","202-225-2995","38.8863235","-77.011373","2436 Rayburn Hob, Washington, DC 20515","2436",,"Rayburn Hob",,,"Washington","DC","20515",,"https://foxx.house.gov","http://foxx.house.gov/contact/","https://www.facebook.com/RepVirginiaFoxx","virginiafoxx","https://twitter.com/virginiafoxx","https://cdn.civil.services/us-house/headshots/512x512/virginia-foxx.jpg"
"North Carolina","north-carolina","NC","nc","6","false","false","W000819","2255","412670","N00035311","146255","H4NC06052","2126","Q17388892","kg:/m/0115r5gz","representative","republican","Mark Walker","mark-walker","Mark",,"Walker",,,"MARK WAWL-ker","male","white-american","southern-baptist","no","1969-05-20","2015-01-06","2019-01-03","Mark Walker, a Representative from North Carolina; born in Dothan, Houston County, Ala., May 20, 1969; attended Trinity Baptist College, Jacksonville, Fla., 1987-1988; B.A., Piedmont International University, Winston-Salem, N.C., 1999; businessman; minister; elected as a Republican to the One Hundred Fourteenth and to the succeeding Congress (January 3, 2015-present).","202-225-3065","202-225-8611","38.8863235","-77.011373","2436 Rayburn Hob, Washington, DC 20515","2436",,"Rayburn Hob",,,"Washington","DC","20515",,"https://walker.house.gov","https://walker.house.gov/contact/email","https://www.facebook.com/RepMarkWalker","RepMarkWalker","https://twitter.com/RepMarkWalker","https://cdn.civil.services/us-house/headshots/512x512/mark-walker.jpg"
"North Carolina","north-carolina","NC","nc","7","false","false","R000603","2256","412641","N00033527","102964","H2NC07096","2097","Q5239255","kg:/m/0jt1s3l","representative","republican","David Rouzer","david-rouzer","David",,"Rouzer",,,"DAY-vid ROW-zer [Rhymes with cow]","male","white-american","southern-baptist","no","1972-02-16","2015-01-06","2019-01-03","David Rouzer, a Representative from North Carolina; born in Landstuhl, Germany, February 16, 1972; graduated from Northern High School, Durham, N.C.; B.S., North Carolina State University, Raleigh, N.C., 1994; businessman; associate administrator and rural administrator, United States Department of Agriculture, 2005-2006; staff, United States Senator Jesse Helms of North Carolina, 1996-2000; staff, United States Senator Elizabeth Dole of North Carolina, 2003-2005; member of the North Carolina state senate, 2009-2012; unsuccessful candidate for election to the One Hundred Thirteenth Congress in 2012; elected as a Republican to the One Hundred Fourteenth and to the succeeding Congress (January 3, 2015-present).","202-225-2731","202-225-5773","38.8863235","-77.011373","2436 Rayburn Hob, Washington, DC 20515","2436",,"Rayburn Hob",,,"Washington","DC","20515",,"https://rouzer.house.gov","https://rouzer.house.gov/contact/email","https://www.facebook.com/RepRouzer","RepDavidRouzer","https://twitter.com/RepDavidRouzer","https://cdn.civil.services/us-house/headshots/512x512/david-rouzer.jpg"
"North Carolina","north-carolina","NC","nc","8","false","false","H001067","2140","412550","N00033630","136448","H2NC08185","1774","Q3956999","kg:/m/0nbwfxs","representative","republican","Richard Hudson","richard-hudson","Richard",,"Hudson",,,"RICH-erd HUHD-suhn","male","white-american","christian","no","1971-11-04","2013-01-03","2019-01-03","Richard Hudson, a Representative from North Carolina; born in Franklin, Va., November 4, 1971; graduated from Myers Park High School, Charlotte, N.C., 1990; B.A., University of North Carolina, Charlotte, N.C., 1996; communications director, North Carolina Republican party; business owner; staff, United States Representative Robert (Robin) Hayes of North Carolina, 2000-2005; staff, United States Representative Virginia Ann Foxx of North Carolina, 2005-2006; staff, United States Representative John R. Carter of Texas, 2006-2009; staff, United States Representative K. Michael Conaway of Texas, 2009-2011; elected as a Republican to the One Hundred Thirteenth and to the two succeeding Congresses (January 3, 2013-present).","202-225-3715","704-782-1004","38.8863235","-77.011373","2436 Rayburn Hob, Washington, DC 20515","2436",,"Rayburn Hob",,,"Washington","DC","20515",,"https://hudson.house.gov","https://hudson.house.gov/email-me/","https://www.facebook.com/RepRichHudson","RepRichHudson","https://twitter.com/RepRichHudson","https://cdn.civil.services/us-house/headshots/512x512/richard-hudson.jpg"
"North Carolina","north-carolina","NC","nc","9","false","false","P000606","2141","412551","N00034416","41272","H2NC09134","1775","Q3956848","kg:/m/02b5bx","representative","republican","Robert Pittenger","robert-pittenger","Robert",,"Pittenger",,,"RAH-bert PITT-n-jer","male","white-american","pentecostal","no","1948-08-15","2013-01-03","2019-01-03","Robert Pittenger, a Representative from North Carolina; born in Dallas, Dallas County, Tex., August 15, 1948; B.A., University of Texas, Austin, Tex., 1970; campus ministry organizer; business owner; member of the North Carolina state senate, 2003-2008; unsuccessful candidate for lieutenant governor of North Carolina in 2008; elected as a Republican to the One Hundred Thirteenth and to the two succeeding Congresses (January 3, 2013-present).","202-225-1976","202-225-3389","38.8863235","-77.011373","2436 Rayburn Hob, Washington, DC 20515","2436",,"Rayburn Hob",,,"Washington","DC","20515",,"https://pittenger.house.gov","https://pittenger.house.gov/contact/email-me","https://www.facebook.com/congressmanpittenger",,,"https://cdn.civil.services/us-house/headshots/512x512/robert-pittenger.jpg"
"North Carolina","north-carolina","NC","nc","10","false","false","M001156","1792","400644","N00026627","21031","H4NC10047","650","Q2057809","kg:/m/02b4rz","representative","republican","Patrick McHenry","patrick-mchenry","Patrick","T.","McHenry",,,"PAT-chrik mick-HEN-ree","male","white-american","roman-catholic","no","1975-10-22","2005-01-04","2019-01-03","Patrick McHenry, a Representative from North Carolina; born in Charlotte, Mecklenburg County, N.C., October 22, 1975; graduated Ashbrook High School, Gastonia, N.C., 1994; attended North Carolina State University, Raleigh, N.C.; B.A., Belmont Abbey College, Belmont, N.C., 1999; realtor; appointed special assistant to the United States Secretary of Labor by President George W. Bush in 2001; member of the North Carolina state house of representatives, 2002-2004; elected as a Republican to the One Hundred Ninth and to the six succeeding Congresses (January 3, 2005-present).","202-225-2576","202-225-0316","38.8863235","-77.011373","2436 Rayburn Hob, Washington, DC 20515","2436",,"Rayburn Hob",,,"Washington","DC","20515",,"https://mchenry.house.gov","http://mchenry.house.gov/contact/zipauth.htm","https://www.facebook.com/CongressmanMcHenry","PatrickMcHenry","https://twitter.com/PatrickMcHenry","https://cdn.civil.services/us-house/headshots/512x512/patrick-mchenry.jpg"
"North Carolina","north-carolina","NC","nc","11","false","false","M001187","2142","412552","N00033631","136459","H2NC11080","1776","Q3956796","kg:/m/0lqdy32","representative","republican","Mark Meadows","mark-meadows","Mark",,"Meadows",,,"MARK MED-ohz","male","white-american","christian","no","1959-07-28","2013-01-03","2019-01-03","Mark Meadows, a Representative from North Carolina; born in Verdun, France, July 28, 1959; attended Florida State University, Tallahassee, Fla.; B.A., University of South Florida, Tampa, Fla.; public relations director; business owner; elected as a Republican to the One Hundred Thirteenth and to the two succeeding Congresses (January 3, 2013-present).","202-225-6401","202-226-6422","38.8863235","-77.011373","2436 Rayburn Hob, Washington, DC 20515","2436",,"Rayburn Hob",,,"Washington","DC","20515",,"https://meadows.house.gov","https://meadows.house.gov/contact/email-me","https://www.facebook.com/Repmarkmeadows","RepMarkMeadows","https://twitter.com/RepMarkMeadows","https://cdn.civil.services/us-house/headshots/512x512/mark-meadows.jpg"
"North Carolina","north-carolina","NC","nc","12","false","false","A000370","2201","412607","N00035451","5935","H4NC12100","2063","Q4733597","kg:/m/02b45d","representative","democrat","Alma Adams","alma-adams","Alma",,"Adams",,,"AL-muh ADD-umz","female","african-american","baptist","no","1946-05-27","2014-11-12","2019-01-03","Alma Adams, a Representative from North Carolina; born in High Point, Guilford County, N.C., May 27, 1946; graduated from West Side High School, Newark, N.J., 1964; B.S., North Carolina Agricultural and Technical State University, Greensboro, N.C., 1968; M.S., North Carolina Agricultural and Technical State University, Greensboro, N.C., 1972; Ph.D., Ohio State University, Columbus, Ohio, 1981; artist; faculty, Bennett College, Greensboro, N.C., 1972-2012; member of the Greensboro, N.C., school board, 1984-1986; member of the Greensboro, N.C., city council, 1987-1994; member of the North Carolina state house of representatives, 1994-2014; elected simultaneously as a Democrat to the One Hundred Thirteenth and One Hundred Fourteenth Congresses, by special election, to fill the vacancy caused by the resignation of United States Representative Melvin L. Watt, and reelected to the succeeding Congress (November 4, 2014-present).","202-225-1510","202-225-1512","38.8863235","-77.011373","2436 Rayburn Hob, Washington, DC 20515","2436",,"Rayburn Hob",,,"Washington","DC","20515",,"https://adamsforms.house.gov","http://adamsforms.house.gov/contact/","https://www.facebook.com/CongresswomanAdams","RepAdams","https://twitter.com/RepAdams","https://cdn.civil.services/us-house/headshots/512x512/alma-adams.jpg"
