state_name,state_name_slug,state_code,state_code_slug,district,at_large,vacant,bioguide,thomas,govtrack,opensecrets,votesmart,fec,maplight,wikidata,google_entity_id,title,party,name,name_slug,first_name,middle_name,last_name,name_suffix,goes_by,pronunciation,gender,ethnicity,religion,openly_lgbtq,date_of_birth,entered_office,term_end,biography,phone,fax,latitude,longitude,address_complete,address_number,address_prefix,address_street,address_sec_unit_type,address_sec_unit_num,address_city,address_state,address_zipcode,address_type,website,contact_page,facebook_url,twitter_handle,twitter_url,photo_url
"Oklahoma","oklahoma","OK","ok","5","false","false","R000604","2265","412650","N00036175",,"H4OK05132","2106","Q16195304","kg:/m/0ndnv6f","representative","republican","Steve Russell","steve-russell","Steve",,"Russell",,,"STEEV RUH-suhl","male","white-american","southern-baptist","no","1963-05-25","2015-01-06","2019-01-03","Steve Russell, a Representative from Oklahoma; born in Oklahoma City, Oklahoma County, Okla., on May 25, 1963; graduated from Del City High School, Del City, Okla., 1981; B.A., Ouachita Baptist University, Arkadelphia, Ark., 1985; United States Army, 1985-2006; author; small business owner; member of the Oklahoma state senate, 2008-2012; elected as a Republican to the One Hundred Fourteenth and to the succeeding Congress (January 3, 2015-present).","202-225-2132","202-226-1463","38.8863235","-77.011373","2436 Rayburn Hob, Washington, DC 20515","2436",,"Rayburn Hob",,,"Washington","DC","20515",,"https://russell.house.gov","https://russell.house.gov/contact/email","https://www.facebook.com/pages/Congressman-Steve-Russell/996556490372532","RepRussell","https://twitter.com/RepRussell","https://cdn.civil.services/us-house/headshots/512x512/steve-russell.jpg"
"Oregon","oregon","OR","or","1","false","false","B001278","2092","412501","N00033474","59641","H2OR01133","1682","Q45946","kg:/m/02q453x","representative","democrat","Suzanne Bonamici","suzanne-bonamici","Suzanne",,"Bonamici",,,"soo-ZANN bahn-uh-MEE-chee","female","white-american","jewish","no","1954-10-14","2012-02-07","2019-01-03","Suzanne Bonamici, a Representative from Oregon; born in Detroit, Wayne County, Mich., October 14, 1954; A.A., Lane Community College, Eugene, Oreg. 1978; B.A., University of Oregon, Eugene, Oreg., 1980; J.D., University of Oregon, Eugene, Oreg., 1983; lawyer, Federal Trade Commission, Washington, D.C.; lawyer, private practice; staff, Oregon state house of representatives, 2001-2006; member of Oregon state house of representatives 2007-2008; member of Oregon state senate, 2008-2011; elected as a Democrat to the One Hundred Twelfth Congress, by special election, to fill the vacancy caused by the resignation of United States Representative David Wu, and reelected to the three succeeding Congresses (January 31, 2012-present).","202-225-0855","202-225-9497","38.8863235","-77.011373","2436 Rayburn Hob, Washington, DC 20515","2436",,"Rayburn Hob",,,"Washington","DC","20515",,"https://bonamici.house.gov","https://bonamici.house.gov/contact-me/email-me","https://www.facebook.com/CongresswomanBonamici","RepBonamici","https://twitter.com/RepBonamici","https://cdn.civil.services/us-house/headshots/512x512/suzanne-bonamici.jpg"
"Oregon","oregon","OR","or","2","false","false","W000791","1596","400419","N00007690","2979","H6OR02116","504","Q1397359","kg:/m/033tx_","representative","republican","Greg Walden","greg-walden","Greg",,"Walden",,,"GREHG WAWL-duhn","male","white-american","episcopalian","no","1957-01-10","1999-01-06","2019-01-03","Greg Walden, a Representative from Oregon; born in The Dalles, Wasco County, Ore., January 10, 1957; B.S., University of Oregon, Eugene, Ore., 1981; member of the Oregon state house of representatives, 1989-1995; member of the Oregon state senate, 1995-1997; elected as a Republican to the One Hundred Sixth and to the nine succeeding Congresses (January 3, 1999-present); chair, Committee on Energy & Commerce (One Hundred Fifteenth Congress).","202-225-6730","202-225-5774","38.8863235","-77.011373","2436 Rayburn Hob, Washington, DC 20515","2436",,"Rayburn Hob",,,"Washington","DC","20515",,"https://walden.house.gov","https://walden.house.gov/contact-greg/email-me","https://www.facebook.com/repgregwalden","repgregwalden","https://twitter.com/repgregwalden","https://cdn.civil.services/us-house/headshots/512x512/greg-walden.jpg"
"Oregon","oregon","OR","or","3","false","false","B000574","99","400033","N00007727","367","H6OR03064","152","Q748066","kg:/m/033tw8","representative","democrat","Earl Blumenauer","earl-blumenauer","Earl",,"Blumenauer",,,"EARL BLOO-meh-now-er","male","white-american","protestant","no","1948-08-16","1996-05-21","2019-01-03","Earl Blumenauer, a Representative from Oregon; born in Portland, Multnomah County, Oreg., August 16, 1948; graduated from Centennial High School, Portland, Oreg., 1966; B.A., Lewis and Clark College, Portland, Oreg., 1970; J.D., Lewis and Clark Law School, Portland, Oreg., 1976; assistant to the president of Portland State University, Portland, Oreg., 1970-1977; member of the Oregon state house of representatives, 1973-1978; member of the board of directors, Portland Community College, 1975-1981; Multnomah County, Oreg., commissioner, 1978-1985; Portland, Oreg., city commissioner, 1986-1996; served on the Governor's commission on higher education, 1990-1991; elected as a Democrat, by special election, to the One Hundred Fourth Congress to fill the vacancy caused by the resignation of United States Representative Ronald Lee Wyden, and reelected to the eleven succeeding Congresses (May 21, 1996-present).","202-225-4811","202-225-8941","38.8863235","-77.011373","2436 Rayburn Hob, Washington, DC 20515","2436",,"Rayburn Hob",,,"Washington","DC","20515",,"https://blumenauerforms.house.gov","https://blumenauerforms.house.gov/forms/writeyourrep/","https://www.facebook.com/blumenauer","repblumenauer","https://twitter.com/repblumenauer","https://cdn.civil.services/us-house/headshots/512x512/earl-blumenauer.jpg"
"Oregon","oregon","OR","or","4","false","false","D000191","279","400100","N00007781","27037","H6OR04047","213","Q1758507","kg:/m/033ttx","representative","democrat","Peter DeFazio","peter-defazio","Peter",,"DeFazio",,,"PEE-ter duh-FAH-zee-oh","male","white-american","roman-catholic","no","1947-05-27","1987-01-06","2019-01-03","Peter DeFazio, a Representative from Oregon; born in Needham, Norfolk County, Mass., May 27, 1947; B.A., Tufts University, Medford, Mass., 1969; M.A., University of Oregon, Eugene, Oreg., 1977; United States Air Force Reserve, 1967-1971; staff, United States Representative James Howard Weaver of Oregon, 1977-1982; member of the Lane County, Oreg., board of commissioners, 1983-1986, chair, 1985-1986; unsuccessful candidate for nomination to the United States Senate in a special primary election in 1995; elected as a Democrat to the One Hundredth and to the fifteen succeeding Congresses (January 3, 1987-present).","202-225-6416","541-269-5760","38.8863235","-77.011373","2436 Rayburn Hob, Washington, DC 20515","2436",,"Rayburn Hob",,,"Washington","DC","20515",,"https://defazio.house.gov","http://defazio.house.gov/contact/email-peter","https://www.facebook.com/RepPeterDeFazio","RepPeterDeFazio","https://twitter.com/RepPeterDeFazio","https://cdn.civil.services/us-house/headshots/512x512/peter-defazio.jpg"
"Oregon","oregon","OR","or","5","false","false","S001180","1950","412315","N00030071","10813","H8OR05107","797","Q1387868","kg:/m/0412ntl","representative","democrat","Kurt Schrader","kurt-schrader","Kurt",,"Schrader",,,"KERT SHRAY-dur","male","white-american","episcopalian","no","1951-10-19","2009-01-06","2019-01-03","Kurt Schrader, a Representative from Oregon; born in Bridgeport, Fairfield County, Conn., October 19, 1951; graduated from Champaign Centennial High School, Champaign, Ill., 1969; B.A., Cornell University, Ithaca, N.Y., 1973; B.S., University of Illinois, Urbana-Champaign, Ill., 1975; D.V.M., University of Illinois, Urbana-Champaign, Ill., 1977; veterinarian; farmer; member of the Oregon state house of representatives, 1997-2003; member of the Oregon state senate, 2003-2008; elected as a Democrat to the One Hundred Eleventh and to the four succeeding Congresses (January 3, 2009-present).","202-225-5711","202-225-5699","38.8863235","-77.011373","2436 Rayburn Hob, Washington, DC 20515","2436",,"Rayburn Hob",,,"Washington","DC","20515",,"https://schrader.house.gov","http://schrader.house.gov/contact/","https://www.facebook.com/repschrader","RepSchrader","https://twitter.com/RepSchrader","https://cdn.civil.services/us-house/headshots/512x512/kurt-schrader.jpg"
"Pennsylvania","pennsylvania","PA","pa","1","false","false","B001227","1469","400047","N00001619","2519","H8PA01153","165","Q434522","kg:/m/03tq5z","representative","democrat","Robert Brady","robert-brady","Robert",,"Brady",,"Bob","BAHB BRAY-dee","male","white-american","roman-catholic","no","1945-04-07","1998-05-19","2019-01-03","Robert Brady, a Representative from Pennsylvania; born in Philadelphia, Philadelphia County, Pa., April 7, 1945; graduated from St. Thomas More High School, Philadelphia, Pa.; union official; sergeant-at-arms, Philadelphia, Pa., city council, 1975-1983; chairman, Philadelphia, Pa., Democratic Party; member of the Pennsylvania Democratic state committee and Democratic National Committee; member of the Pennsylvania turnpike commission, 1991-1998; elected as a Democrat to the One Hundred Fifth Congress, by special election, to fill the vacancy caused by the resignation of United States Representative Thomas Foglietta, and reelected to the ten succeeding Congresses (May 19, 1998-present);chair, Committee on House Administration (One Hundred Tenth and One Hundred Eleventh Congresses).","202-225-4731","202-225-0088","38.8863235","-77.011373","2436 Rayburn Hob, Washington, DC 20515","2436",,"Rayburn Hob",,,"Washington","DC","20515",,"https://brady.house.gov","https://brady.house.gov/contact-me/email-me","https://www.facebook.com/pages/Congressman-Robert-Brady/118845109487","repbrady","https://twitter.com/repbrady","https://cdn.civil.services/us-house/headshots/512x512/robert-brady.jpg"
"Pennsylvania","pennsylvania","PA","pa","2","false","false","E000296",,"412677","N00038450","9128","H6PA02171","2167","Q5318148","kg:/m/03y8h6m","representative","democrat","Dwight Evans","dwight-evans","Dwight",,"Evans",,,"DWAHYT EH-vuhnz","male","african-american",,"no","1954-05-16","2016-11-14","2019-01-03","Dwight Evans, a Representative from Pennsylvania; born in Philadelphia, Philadelphia County, Pa., May 16, 1954; graduated from Germantown High School, Philadelphia, Pa., 1971; A.A., Community College of Philadelphia, Philadelphia, Pa.,1973; B.A., La Salle University, Philadelphia, Pa., 1975; teacher, Philadelphia, Pa., public schools; employment counselor, Urban League of Philadelphia, Pa.; member of the Pennsylvania state house of representatives, 1980-2016; unsuccessful candidate for nomination as lieutenant governor of Pennsylvania in 1986; unsuccessful candidate for nomination for Governor of Pennsylvania in 1994; unsuccessful candidate for nomination as Mayor of Philadelphia, Pa., in 1999 & 2007; elected simultaneously as a Democrat to the One Hundred Fourteenth and the One Hundred Fifteenth Congresses, by special election, to fill the vacancy caused by the resignation of United States Representative Chaka Fattah (November 8, 2016-present).","202-225-4001","202-226-0311","38.8863235","-77.011373","2436 Rayburn Hob, Washington, DC 20515","2436",,"Rayburn Hob",,,"Washington","DC","20515",,"https://evans.house.gov","https://evans.house.gov/contact/email","https://www.facebook.com/RepresentativeDwightEvans",,,"https://cdn.civil.services/us-house/headshots/512x512/dwight-evans.jpg"
"Pennsylvania","pennsylvania","PA","pa","3","false","false","K000376","2051","412465","N00031647","119463","H0PA03271","1471","Q1431761","kg:/m/0ds6wcw","representative","republican","Mike Kelly","mike-kelly","Mike",,"Kelly",,,"MIKE KELL-ee","male","white-american","roman-catholic","no","1948-05-10","2011-01-05","2019-01-03","Mike Kelly, a Representative from Pennsylvania; born in Pittsburgh, Allegheny County, Pa., May 10, 1948; B.A., Notre Dame University, South Bend, Ind., 1970; business owner; member of the Butler Pa., area school board, 1992-1995; member of the Butler County, Pa., council, 2006-2009; elected as a Republican to the One Hundred Twelfth and to the three succeeding Congresses (January 3, 2011-present).","202-225-5406","202-225-3103","38.8863235","-77.011373","2436 Rayburn Hob, Washington, DC 20515","2436",,"Rayburn Hob",,,"Washington","DC","20515",,"https://kelly.house.gov","https://kelly.house.gov/contact-me/email-me","https://www.facebook.com/MikeKellyPA/","MikeKellyPA","https://twitter.com/MikeKellyPA","https://cdn.civil.services/us-house/headshots/512x512/mike-kelly.jpg"
"Pennsylvania","pennsylvania","PA","pa","4","false","false","P000605","2157","412569","N00034120","59980","H2PA04135","1793","Q7437040","kg:/m/04mwt6y","representative","republican","Scott Perry","scott-perry","Scott",,"Perry",,,"SKAHT PAIR-ee","male","white-american","christian","no","1962-05-27","2013-01-03","2019-01-03","Scott Perry, a Representative from Pennsylvania; born in San Diego, San Diego County, Calif., May 27, 1962; B.S., Pennsylvania State University, University Park, Pa., 1991; Pennsylvania Army National Guard, 1980-present; business owner; member of the Pennsylvania state house of representatives, 2007-2012; elected as a Republican to the One Hundred Thirteenth and to the two succeeding Congresses (January 3, 2013-present).","202-225-5836","202-226-1000","38.8863235","-77.011373","2436 Rayburn Hob, Washington, DC 20515","2436",,"Rayburn Hob",,,"Washington","DC","20515",,"https://perry.house.gov","http://perry.house.gov/contact/","https://www.facebook.com/repscottperry","RepScottPerry","https://twitter.com/RepScottPerry","https://cdn.civil.services/us-house/headshots/512x512/scott-perry.jpg"
"Pennsylvania","pennsylvania","PA","pa","5","false","false","T000467","1952","412317","N00029736","24046","H8PA05071","799","Q1531120","kg:/m/0409b0_","representative","republican","Glenn Thompson","glenn-thompson","Glenn","W.","Thompson",,,"GLENN TAHMP-suhn","male","white-american","protestant","no","1959-07-27","2009-01-06","2019-01-03","Glenn Thompson, a Representative from Pennsylvania; born in Bellefonte, Centre County, Pa., July 27, 1959; B.S., Pennsylvania State University, University Park, Pa., 1981; M.Ed., Temple University, Philadelphia, Pa., 1988; rehabilitation therapist manager; member of the Bald Eagle, Pa., school board, 1990-1995; unsuccessful candidate for nomination to the Pennsylvania state house of representatives in 1998 and 2000; chairman, Centre County Pa., Republican Party, 2002-2008; elected as a Republican to the One Hundred Eleventh and to the four succeeding Congresses (January 3, 2009-present).","202-225-5121","202-225-5796","38.8863235","-77.011373","2436 Rayburn Hob, Washington, DC 20515","2436",,"Rayburn Hob",,,"Washington","DC","20515",,"https://thompson.house.gov","https://thompson.house.gov/contact-me/email-me","https://www.facebook.com/CongressmanGT","CongressmanGT","https://twitter.com/CongressmanGT","https://cdn.civil.services/us-house/headshots/512x512/glenn-thompson.jpg"
"Pennsylvania","pennsylvania","PA","pa","6","false","false","C001106","2266","412651","N00031064","133557","H0PA06076","2107","Q18631846","kg:/m/0127dxsz","representative","republican","Ryan Costello","ryan-costello","Ryan",,"Costello",,,"RAHY-uhn kah-STELL-oh","male","white-american","presbyterian","no","1976-09-07","2015-01-06","2019-01-03","Ryan Costello, a Representative from Pennsylvania; born in Chester County, Pa., on September 7, 1976; graduated from Owen J. Roberts High School, Pottstown, Pa., 1995; B.A., Ursinus College, Collegeville, Pa., 1999; LL.B., Villanova University, Villanova, Pa., 2002; lawyer, private practice; member of the Chester County, Pa., board of commissioners, 2011-2013; elected as a Republican to the One Hundred Fourteenth and to the succeeding Congress (January 3, 2015-present).","202-225-4315","610-696-2985","38.8863235","-77.011373","2436 Rayburn Hob, Washington, DC 20515","2436",,"Rayburn Hob",,,"Washington","DC","20515",,"https://costello.house.gov","https://costello.house.gov/contact/email","https://www.facebook.com/CongressmanRyanCostello","RepRyanCostello","https://twitter.com/RepRyanCostello","https://cdn.civil.services/us-house/headshots/512x512/ryan-costello.jpg"
"Pennsylvania","pennsylvania","PA","pa","7","false","false","M001181","2052","412466","N00031134","119474","H0PA07082","1472","Q2056533","kg:/m/03m4jty","representative","republican","Pat Meehan","pat-meehan","Pat",,"Meehan",,,"PATT MEE-in","male","white-american","roman-catholic","no","1955-10-20","2011-01-05","2019-01-03","Pat Meehan, a Representative from Pennsylvania; born in Cheltenham, Montgomery County, Pa., October 20, 1955; graduated from Chestnut Hill Academy, Philadelphia, Pa., 1974; B.A., Bowdoin College, Brunswick, Maine, 1978; J.D., Temple University, Philadelphia, Pa., 1986; lawyer, private practice; United States Attorney for the Eastern District of Pennsylvania, 2001-2008; staff, United States Senator Arlen Specter, 1991-1994; Delaware County, Pa., district attorney, 1996-2001; elected as a Republican to the One Hundred Twelfth and to the three succeeding Congresses (January 3, 2011-present).","202-225-2011","202-226-0280","38.8863235","-77.011373","2436 Rayburn Hob, Washington, DC 20515","2436",,"Rayburn Hob",,,"Washington","DC","20515",,"https://meehan.house.gov","https://meehan.house.gov/contact/email-me","https://www.facebook.com/CongressmanPatrickMeehan","RepMeehan","https://twitter.com/RepMeehan","https://cdn.civil.services/us-house/headshots/512x512/pat-meehan.jpg"
"Pennsylvania","pennsylvania","PA","pa","8","false","false","F000466",,"412721","N00038779","167708","H6PA08277","2233","Q27831059",,"representative","republican","Brian Fitzpatrick","brian-fitzpatrick","Brian",,"Fitzpatrick",,,"BRAHY-uhn fitz-PAT-chrik","male","white-american","roman-catholic","no","1973-12-17","2017-01-03","2019-01-03","Brian Fitzpatrick, (brother of Michael G. Fitzpatrick), a Representative from Pennsylvania; born in Philadelphia, Philadelphia County, Pa., December 17, 1973; graduated from Bishop Egan High School, Fairless Hills, Pa.; B.S.B.A., La Salle University, Philadelphia, Pa., 1996; M.B.A., Pennsylvania State University, University Park, Pa., 2001; J.D., Dickinson School of Law, Pennsylvania State University, Carlisle, Pa., 2001; judicial clerk, Eastern District of Pennsylvania, 2001-2002; special agent, Federal Bureau of Investigation; special assistant United States attorney for the Eastern District of Pennsylvania; lawyer, private practice; accountant; elected as a Republican to the One Hundred Fifteenth Congress (January 3, 2017-present).","202-225-4276","202-225-9511","38.8863235","-77.011373","2436 Rayburn Hob, Washington, DC 20515","2436",,"Rayburn Hob",,,"Washington","DC","20515",,"https://brianfitzpatrick.house.gov","https://brianfitzpatrick.house.gov/contact/email","https://www.facebook.com/BrianFitzpatrickForCongress/","BrianFitzUSA","https://twitter.com/BrianFitzUSA","https://cdn.civil.services/us-house/headshots/512x512/brian-fitzpatrick.jpg"
"Pennsylvania","pennsylvania","PA","pa","9","false","false","S001154","1681","409888","N00013770","55693","H2PA09035","669","Q862455","kg:/m/03tm89","representative","republican","Bill Shuster","bill-shuster","Bill",,"Shuster",,,"BILL SHOO-ster","male","white-american","lutheran","no","1961-01-10","2001-05-17","2019-01-03","Bill Shuster, (son of E. G. Bud" Shuster)","202-225-2431","202.225.2486","38.8863235","-77.011373","2436 Rayburn Hob, Washington, DC 20515","2436",,"Rayburn Hob",,,"Washington","DC","20515",,"https://shuster.house.gov","https://shuster.house.gov/contact-form/","https://www.facebook.com/Rep.Shuster","RepBillShuster","https://twitter.com/RepBillShuster","https://cdn.civil.services/us-house/headshots/512x512/bill-shuster.jpg"
"Pennsylvania","pennsylvania","PA","pa","10","false","false","M001179","2053","412468","N00031777","119478","H0PA10078","1473","Q2439864","kg:/m/02qv_mf","representative","republican","Tom Marino","tom-marino","Tom",,"Marino",,,"TAHM muh-REE-noh","male","white-american","roman-catholic","no","1952-08-15","2011-01-05","2019-01-03","Tom Marino, a Representative from Pennsylvania; born in Williamsport, Lycoming County, Pa., August 15, 1952; graduated from Williamsport Area High School, Williamsport, Pa., 1970; A.A., Williamsport Area Community College, Williamsport, Pa., 1983; B.A., Lycoming College, Williamsport, Pa., 1985; J.D., Dickinson School of Law, Carlisle, Pa., 1988; manufacturing manager; lawyer, private practice; Lycoming County, Pa., district attorney, 1992-2002; United States attorney for the Middle District of Pennsylvania, 1992-2002; elected as a Republican to the One Hundred Twelfth and to the three succeeding Congresses (January 3, 2011-present).","202-225-3731","202-225-9594","38.8863235","-77.011373","2436 Rayburn Hob, Washington, DC 20515","2436",,"Rayburn Hob",,,"Washington","DC","20515",,"https://marino.house.gov","https://marino.house.gov/contact/email","https://www.facebook.com/CongressmanMarino","RepTomMarino","https://twitter.com/RepTomMarino","https://cdn.civil.services/us-house/headshots/512x512/tom-marino.jpg"
"Pennsylvania","pennsylvania","PA","pa","11","false","false","B001269","2054","412469","N00025495","47143","H2PA11098","1474","Q25568","kg:/m/03wcvjl","representative","republican","Lou Barletta","lou-barletta","Lou",,"Barletta",,,"LOO bar-LET-uh","male","white-american","roman-catholic","no","1956-01-28","2011-01-05","2019-01-03","Lou Barletta, a Representative from Pennsylvania; born in Hazleton, Luzerne County, Pa., January 28, 1956; graduated from Hazleton High School, Hazleton, Pa., 1974; attended Bloomsburg University, Bloomsburg, Pa.; professional athlete; business owner; member of the Hazleton, Pa., city council, 1998-2000; Mayor of Hazleton, Pa., 2000-2010; elected as a Republican to the One Hundred Twelfth and to the three succeeding Congresses (January 3, 2011-present).","202-225-6511","202-226-6250","38.8863235","-77.011373","2436 Rayburn Hob, Washington, DC 20515","2436",,"Rayburn Hob",,,"Washington","DC","20515",,"https://barletta.house.gov","https://barletta.house.gov/contact/email-me","https://www.facebook.com/CongressmanLouBarletta","RepLouBarletta","https://twitter.com/RepLouBarletta","https://cdn.civil.services/us-house/headshots/512x512/lou-barletta.jpg"
"Pennsylvania","pennsylvania","PA","pa","12","false","false","R000598","2158","412570","N00031253","119466","H0PA04220","1794","Q5978897","kg:/m/0ds0r5g","representative","republican","Keith Rothfus","keith-rothfus","Keith",,"Rothfus",,,"KEETH RAHTH-fus","male","white-american","roman-catholic","no","1962-04-25","2013-01-03","2019-01-03","Keith Rothfus, a Representative from Pennsylvania; born in Endicott, Broome County, N.Y., April 25, 1962; graduated from West Seneca West Senior High School, West Seneca, N.Y., 1980; B.S., State University of New York-Buffalo State, Buffalo, N.Y., 1984; J.D., University of Notre Dame, Notre Dame, Ind., 1990; lawyer, private practice; staff, United States Department of Homeland Security, 2006-2007; unsuccessful candidate for election to the One Hundred Twelfth Congress in 2010; elected as a Republican to the One Hundred Thirteenth and to the two succeeding Congresses (January 3, 2013-present).","202-225-2065","202-225-5709","38.8863235","-77.011373","2436 Rayburn Hob, Washington, DC 20515","2436",,"Rayburn Hob",,,"Washington","DC","20515",,"https://rothfus.house.gov","https://rothfus.house.gov/email-keith","https://www.facebook.com/keithrothfus","KeithRothfus","https://twitter.com/KeithRothfus","https://cdn.civil.services/us-house/headshots/512x512/keith-rothfus.jpg"
"Pennsylvania","pennsylvania","PA","pa","13","false","false","B001296","2267","412652","N00035307","47357","H4PA13199","2108","Q4960876","kg:/m/04f4fjk","representative","democrat","Brendan Boyle","brendan-boyle","Brendan",,"Boyle",,,"BREN-duhn BOYL","male","white-american","roman-catholic","no","1977-02-06","2015-01-06","2019-01-03","Brendan Boyle, a Representative from Pennsylvania; born in Philadelphia, Philadelphia County, Pa., on February 6, 1977; graduated from Cardinal Dougherty High School, Philadelphia, Pa., 1995; B.A., University of Notre Dame, Notre Dame, Ind., 1999; M.A., Harvard University School of Public Policy, Cambridge, Mass., 2005; radio broadcaster; management consultant; adjunct professor, Drexel University, Philadelphia, Pa.; member of the Pennsylvania state house of representatives, 2008-2014; elected as a Democrat to the One Hundred Fourteenth and to the succeeding Congress (January 3, 2015-present).","202-225-6111","202-226-0611","38.8863235","-77.011373","2436 Rayburn Hob, Washington, DC 20515","2436",,"Rayburn Hob",,,"Washington","DC","20515",,"https://boyle.house.gov","https://boyle.house.gov/contact/email","https://www.facebook.com/CongressmanBoyle","RepBrendanBoyle","https://twitter.com/RepBrendanBoyle","https://cdn.civil.services/us-house/headshots/512x512/brendan-boyle.jpg"
