state_name,state_name_slug,state_code,state_code_slug,district,at_large,vacant,bioguide,thomas,govtrack,opensecrets,votesmart,fec,maplight,wikidata,google_entity_id,title,party,name,name_slug,first_name,middle_name,last_name,name_suffix,goes_by,pronunciation,gender,ethnicity,religion,openly_lgbtq,date_of_birth,entered_office,term_end,biography,phone,fax,latitude,longitude,address_complete,address_number,address_prefix,address_street,address_sec_unit_type,address_sec_unit_num,address_city,address_state,address_zipcode,address_type,website,contact_page,facebook_url,twitter_handle,twitter_url,photo_url
"Alaska","alaska","AK","ak",,"true","false","Y000033","1256","400440","N00007999","26717","H6AK00045","525","Q1239590","kg:/m/024p1k","representative","republican","Don Young","don-young","Don",,"Young",,,"DAHN YUHNG","male","white-american","episcopalian","no","1933-06-09","1973-01-03","2019-01-03","Don Young, a Representative from Alaska; born in Meridian, Sutter County, Calif., June 9, 1933; A.A., Yuba Junior College, Marysville, Calif., 1952; B.A., California State University, Chico, Calif., 1958; United States Army, 1955-1957; teacher; Mayor of Fort Yukon, Alaska, 1960-1968; riverboat captain, 1968-1972; member of the Fort Yukon, Alaska, city council, 1960-1968; member of the Alaska state house of representatives, 1966-1970; member of the Alaska state senate, 1970-1973; delegate, Alaska state Republican conventions, 1964, 1966, 1968, and 1972; elected as a Republican to the Ninety-third Congress, by special election, to fill the vacancy caused by the death of United States Representative Nick Begich, and reelected to the twenty-two succeeding Congresses (March 6, 1973-present); chair, Committee on Resources (One Hundred Fourth through One Hundred Sixth Congresses); chair, Committee on Transportation and Infrastructure (One Hundred Seventh through One Hundred Ninth Congresses).","202-225-5765",,"38.8863235","-77.011373","2436 Rayburn Hob, Washington, DC 20515","2436",,"Rayburn Hob",,,"Washington","DC","20515",,"https://donyoung.house.gov","http://donyoung.house.gov/contact/","https://www.facebook.com/RepDonYoung","repdonyoung","https://twitter.com/repdonyoung","https://cdn.civil.services/us-house/headshots/512x512/don-young.jpg"
"Alabama","alabama","AL","al","1","false","false","B001289","2197","412601","N00035380","27584","H4AL01123","2054","Q4954892","kg:/m/09g6kty","representative","republican","Bradley Byrne","bradley-byrne","Bradley",,"Byrne",,,"BRADD-lee BURN","male","white-american","episcopalian","no","1955-02-16","2014-01-08","2019-01-03","Bradley Byrne, a Representative from Alabama; born in Mobile, Mobile County, Ala., February 16, 1955; graduated from University Military School, Mobile, Ala., 1973; B.A., Duke University, Durham, N.C., 1977; J.D., University of Alabama School of Law, Tuscaloosa, Ala., 1980; lawyer, private practice; member of the Alabama state board of education, 1994-2002; member of the Alabama state senate, 2002-2007; chancellor of the Alabama department of postsecondary education, 2007-2009; unsuccessful candidate for nomination for governor of Alabama in 2010; elected as a Republican, by special election, to the One Hundred Thirteenth Congress to fill the vacancy caused by the resignation of United States Representative Josiah Robins (Jo) Bonner, Jr., and to the two succeeding Congresses (December 17, 2013-Present). (fu","202-225-4931","202-225-0562","38.8863235","-77.011373","2436 Rayburn Hob, Washington, DC 20515","2436",,"Rayburn Hob",,,"Washington","DC","20515",,"https://byrne.house.gov","https://byrne.house.gov/contact/email-me","https://www.facebook.com/RepByrne/","RepByrne","https://twitter.com/RepByrne","https://cdn.civil.services/us-house/headshots/512x512/bradley-byrne.jpg"
"Alabama","alabama","AL","al","2","false","false","R000591","1986","412394","N00030768","71604","H0AL02087","1408","Q439117","kg:/m/0drx5mb","representative","republican","Martha Roby","martha-roby","Martha",,"Roby",,,"MAR-thuh ROH-bee","female","white-american","presbyterian","no","1976-07-27","2011-01-05","2019-01-03","Martha Roby, a Representative from Alabama; born in Montgomery, Montgomery County, Ala., July 27, 1976; B.M., New York University, New York, N. Y., 1998; J.D., Samford University, Birmingham, Ala., 2001; lawyer, private practice; member of the Montgomery, Ala., city council, 2003-2010; elected as a Republican to the One Hundred Twelfth and to the three succeeding Congresses (January 3, 2011-present).","202-225-2901","202-225-8913","38.8863235","-77.011373","2436 Rayburn Hob, Washington, DC 20515","2436",,"Rayburn Hob",,,"Washington","DC","20515",,"https://roby.house.gov","https://roby.house.gov/contact-me","https://www.facebook.com/Representative.Martha.Roby/","RepMarthaRoby","https://twitter.com/RepMarthaRoby","https://cdn.civil.services/us-house/headshots/512x512/martha-roby.jpg"
"Alabama","alabama","AL","al","3","false","false","R000575","1704","400341","N00024759","5705","H2AL03032","433","Q693238","kg:/m/024n_s","representative","republican","Mike Rogers","mike-rogers","Mike",,"Rogers",,,"MIKE RAH-jerz","male","white-american","baptist","no","1958-07-16","2003-01-07","2019-01-03","Mike Rogers, a Representative from Alabama; born in Hammond, Lake County, Ind., July 16, 1958; graduated from Saks High School, Anniston, Ala., 1976; B.A., Jacksonville State University, Jacksonville, Ala., 1981; M.P.A., Jacksonville State University, Jacksonville, Ala., 1984; J.D., Birmingham School of Law, Birmingham, Ala., 1991; member of the Calhoun County, Ala., commission, 1987-1990; member of the Alabama state house of representatives, 1994-2002, minority leader, 1998-2000; elected as a Republican to the One Hundred Eighth and to the seven succeeding Congresses (January 3, 2003-present).","202-225-3261","202-226-8485","38.8863235","-77.011373","2436 Rayburn Hob, Washington, DC 20515","2436",,"Rayburn Hob",,,"Washington","DC","20515",,"https://mikerogers.house.gov","https://mikerogers.house.gov/contact-mike/email-me",,"RepMikeRogersAL","https://twitter.com/RepMikeRogersAL","https://cdn.civil.services/us-house/headshots/512x512/mike-rogers.jpg"
"Alabama","alabama","AL","al","4","false","false","A000055","1460","400004","N00003028","441","H6AL04098","127","Q672671","kg:/m/024p03","representative","republican","Robert Aderholt","robert-aderholt","Robert",,"Aderholt",,,"RAH-bert ADD-er-holt","male","white-american","congregationalist","no","1965-07-22","1997-01-07","2019-01-03","Robert Aderholt, a Representative from Alabama; born in Haleyville, Winston County, Ala., July 22, 1965; B.A., Birmingham Southern College, Birmingham, Ala., 1987; J.D., Samford University, Birmingham, Ala., 1990; lawyer, private practice; Haleyville, Ala., municipal judge, 1992-1995; staff, Alabama Governor Fob James, 1995-1996; elected as a Republican to the One Hundred Fifth and to the ten succeeding Congresses (January 3, 1997-present).","202-225-4876",,"38.8863235","-77.011373","2436 Rayburn Hob, Washington, DC 20515","2436",,"Rayburn Hob",,,"Washington","DC","20515",,"https://aderholt.house.gov","https://aderholt.house.gov/contact-robert","https://www.facebook.com/RobertAderholt/","Robert_Aderholt","https://twitter.com/Robert_Aderholt","https://cdn.civil.services/us-house/headshots/512x512/robert-aderholt.jpg"
"Alabama","alabama","AL","al","5","false","false","B001274","1987","412395","N00030910","121610","H0AL05163","1409","Q1941306","kg:/m/0c3xdjf","representative","republican","Mo Brooks","mo-brooks","Mo",,"Brooks",,,"MOH BROOKS","male","white-american","christian","no","1954-04-29","2011-01-05","2019-01-03","Mo Brooks, a Representative from Alabama; born in Charleston, Charleston County, S.C., April 29, 1954; graduated from Grissom High School, Huntsville, Ala., 1972; B.A., Duke University, Durham, N.C., 1975; J.D., University of Alabama School of Law, Tuscaloosa, Ala., 1978; lawyer, private practice; Tuscaloosa County, Ala. prosecutor, 1978-1980; clerk, Circuit Court Judge John Snodgrass, 1980-1982; member of the Alabama house of representatives, 1982-1992; Madison County, Ala. district attorney, 1991-1993; special assistant attorney general, state of Alabama, 1995-2002; commissioner, Madison County, Ala., board of commissions, 1996-2010; elected as a Republican to the One Hundred Twelfth and to the three succeeding Congresses (January 3, 2011-present).","202-225-4801","202-225-4392","38.8863235","-77.011373","2436 Rayburn Hob, Washington, DC 20515","2436",,"Rayburn Hob",,,"Washington","DC","20515",,"https://brooks.house.gov","https://brooks.house.gov/contact-me","https://www.facebook.com/RepMoBrooks/","RepMoBrooks","https://twitter.com/RepMoBrooks","https://cdn.civil.services/us-house/headshots/512x512/mo-brooks.jpg"
"Alabama","alabama","AL","al","6","false","false","P000609","2221","412608","N00035691","146274","H4AL06098","2064","Q17386504","kg:/m/0115nklq","representative","republican","Gary Palmer","gary-palmer","Gary",,"Palmer",,,"GAIR-ee PAWL-mer","male","white-american","christian","no","1954-05-14","2015-01-06","2019-01-03","Gary Palmer, a Representative from Alabama; born in Haleyville, Winston County, Ala., May 14, 1954; graduated from Hackleburg High School, Hackleburg, Ala., 1972; attended Northwest Alabama Junior College, Phil Campbell, Ala., 1972-1974; B.S., University of Alabama, Tuscaloosa, Ala., 1977; engineer; professional advocate; elected as a Republican to the One Hundred Fourteenth Congress and to the succeeding Congress (January 3, 2015-present).","202-225-4921","202-225-2082","38.8863235","-77.011373","2436 Rayburn Hob, Washington, DC 20515","2436",,"Rayburn Hob",,,"Washington","DC","20515",,"https://palmer.house.gov","https://palmer.house.gov/contact","https://www.facebook.com/CongressmanGaryPalmer/","USRepGaryPalmer","https://twitter.com/USRepGaryPalmer","https://cdn.civil.services/us-house/headshots/512x512/gary-palmer.jpg"
"Alabama","alabama","AL","al","7","false","false","S001185","1988","412396","N00030622","121621","H0AL07086","1410","Q461621","kg:/m/05pbszt","representative","democrat","Terri Sewell","terri-sewell","Terri","A.","Sewell",,,"TAIR-ee SOO-uhl","female","african-american","protestant","no","1965-01-01","2011-01-05","2019-01-03","Terri Sewell, a Representative from Alabama; born in Huntsville, Madison County, Ala., January 1, 1965; graduated from Selma High School, Selma, Ala., 1982; A.B., Princeton University, Princeton, N.J., 1986; M.A., Oxford University, Oxford, England, 1988; J.D., Harvard University, Cambridge, Mass., 1992; lawyer, private practice; elected as a Democrat to the One Hundred Twelfth and to the three succeeding Congresses (January 3, 2011-present). (function(i,s,o,g,r,a,m){i['GoogleAnalyticsObject']=r;i[r]=i[r]||function(){ (i[r].q=i[r].q||[]).push(arguments)},i[r].l=1*new Date();a=s.createElement(o), m=s.getElementsByTagName(o)[0];a.async=1;a.src=g;m.parentNode.insertBefore(a,m)})(window,document,'script','https://www.google-analytics.com/analytics.js','ga'); ga('create', 'UA-9875785-21', 'auto'); ga('send', 'pageview');</","202-225-2665","202-226-9567","38.8863235","-77.011373","2436 Rayburn Hob, Washington, DC 20515","2436",,"Rayburn Hob",,,"Washington","DC","20515",,"https://sewell.house.gov","https://sewell.house.gov/contact/email-me","https://www.facebook.com/RepSewell/","RepTerriSewell","https://twitter.com/RepTerriSewell","https://cdn.civil.services/us-house/headshots/512x512/terri-sewell.jpg"
"Arkansas","arkansas","AR","ar","1","false","false","C001087","1989","412400","N00030770","119208","H0AR01083","1414","Q2151554","kg:/m/0czb3pp","representative","republican","Rick Crawford","rick-crawford","Rick",,"Crawford",,,"RICK KRAW-ferd","male","white-american","southern-baptist","no","1966-01-22","2011-01-05","2019-01-03","Rick Crawford, a Representative from Arkansas; born at Homestead Air Force Base, Miami-Dade County, Florida, January 22, 1966; graduated from Alvirne High School in Hudson, N.H.; United States Army, 1985-1989; B.S., Arkansas State University, Jonesboro, Ark., 1996; journalist; business owner; elected as a Republican to the One Hundred Twelfth and to the three succeeding Congresses (January 3, 2011-present).","202-225-4076","202-225-5602","38.8863235","-77.011373","2436 Rayburn Hob, Washington, DC 20515","2436",,"Rayburn Hob",,,"Washington","DC","20515",,"https://crawford.house.gov","http://crawford.house.gov/contact/","https://www.facebook.com/RepRickCrawford/","RepRickCrawford","https://twitter.com/RepRickCrawford","https://cdn.civil.services/us-house/headshots/512x512/rick-crawford.jpg"
"Arkansas","arkansas","AR","ar","2","false","false","H001072","2223","412609","N00035792","146290","H4AR02141","2065","Q18631366","kg:/m/0127p1zk","representative","republican","French Hill","french-hill","French",,"Hill",,,"FRENCH HILL","male","white-american","roman-catholic","no","1956-12-05","2015-01-06","2019-01-03","French Hill, a Representative from Arkansas; born in Little Rock, Pulaski County, Ark., December 5, 1956; graduated from Little Rock Catholic High School, Little Rock, Ark., 1975; B.S., Vanderbilt University, Nashville, Tenn., 1979; banker; businessman; staff, United States Senate Committee on Banking, Housing, and Urban Affairs, 1982-1984; deputy assistant, United States Treasury, 1989-1991; special assistant to the President and Executive Secretary of Economic Policy Council, 1991-1993; senior advisor, Governor Mike Huckabee of Arkansas, 2008; elected as a Republican to the One Hundred Fourteenth Congress and to the succeeding Congress (January 3, 2015-present).","202-225-2506","202-225-5903","38.8863235","-77.011373","2436 Rayburn Hob, Washington, DC 20515","2436",,"Rayburn Hob",,,"Washington","DC","20515",,"https://hill.house.gov","https://hill.house.gov/contact/email","https://www.facebook.com/RepFrenchHill/","RepFrenchHill","https://twitter.com/RepFrenchHill","https://cdn.civil.services/us-house/headshots/512x512/french-hill.jpg"
"Arkansas","arkansas","AR","ar","3","false","false","W000809","1991","412402","N00031857","71815","H0AR03055","1416","Q1029527","kg:/m/0cmcvkz","representative","republican","Steve Womack","steve-womack","Steve",,"Womack",,,"STEEV WOH-mack","male","white-american","southern-baptist","no","1957-02-18","2011-01-05","2019-01-03","Steve Womack, a Representative from Arkansas; born in Russellville, Pope County, Ark., on February 18, 1957; graduated from Russellville High School, Russellville, Ark., 1975; B.A., Arkansas Tech University, Russellville, Ark., 1979; Arkansas Army National Guard, 1979-2009; radio station manager; consultant; member of the Rogers, Ark., city council, 1983-1984 and 1997-1998; Mayor of Rogers, Ark., 1999-2010; elected as a Republican to the One Hundred Twelfth and to the three succeeding Congresses (January 3, 2011-present).","202-225-4301","202-225-5713","38.8863235","-77.011373","2436 Rayburn Hob, Washington, DC 20515","2436",,"Rayburn Hob",,,"Washington","DC","20515",,"https://womack.house.gov","http://womack.house.gov/contact/","https://www.facebook.com/RepSteveWomack/","rep_stevewomack","https://twitter.com/rep_stevewomack","https://cdn.civil.services/us-house/headshots/512x512/steve-womack.jpg"
"Arkansas","arkansas","AR","ar","4","false","false","W000821","2224","412610","N00035527","119120","H4AR04048","2066","Q16197421","kg:/m/0wklff5","representative","republican","Bruce Westerman","bruce-westerman","Bruce",,"Westerman",,,"BROOS WEST-er-muhn","male","white-american","southern-baptist","no","1967-11-18","2015-01-06","2019-01-03","Bruce Westerman, a Representative from Arkansas; born in Hot Springs, Hot Springs County, Ark., November 18, 1967; graduated from Fountain Lake High School, Hot Springs, Ark., 1986; B.S., University of Arkansas, Fayetteville, Ark., 1990; M.F., Yale Forestry School, New Haven, Conn., 2001; engineer; member of the Fountain Lake, Ark., school board, 2006-2010; member of the Arkansas state house of representatives 2010-2014; elected as a Republican to the One Hundred Fourteenth Congress and to the succeeding Congress (January 3, 2015-present).","202-225-3772","202-225-1314","38.8863235","-77.011373","2436 Rayburn Hob, Washington, DC 20515","2436",,"Rayburn Hob",,,"Washington","DC","20515",,"https://westerman.house.gov","https://westerman.house.gov/contact","https://www.facebook.com/RepWesterman/","RepWesterman","https://twitter.com/RepWesterman","https://cdn.civil.services/us-house/headshots/512x512/bruce-westerman.jpg"
"Arizona","arizona","AZ","az","1","false","false","O000171",,"412682","N00037515","28499","H6AZ01199","2194","Q7817086",,"representative","democrat","Tom O'Halleran","tom-ohalleran","Tom",,"O'Halleran",,,"TAHM oh-HAL-er-uhn","male","white-american","roman-catholic","no","1946-01-24","2017-01-03","2019-01-03","Tom O'Halleran, a Representative from Arizona; born in Chicago, Cook County, Ill., January 24, 1946; graduated from St. Mel High School, Chicago, Ill., 1964; attended Lewis University, Romeoville, Ill., 1965-1966; attended DePaul University, Chicago, Ill., 1991-1992; police officer, Chicago, Ill., 1966-1979; bond trader; business owner; member of the Arizona state house of representatives, 2001-2007; member of the Arizona state senate, 2007-2009; elected as a Democrat to the One Hundred Fifteenth Congress (January 3, 2017-present).","202-225-3361","202-225-3462","38.8863235","-77.011373","2436 Rayburn Hob, Washington, DC 20515","2436",,"Rayburn Hob",,,"Washington","DC","20515",,"https://ohalleran.house.gov","https://ohalleran.house.gov/contact/email","https://www.facebook.com/repohalleran","repohalleran","https://twitter.com/repohalleran","https://cdn.civil.services/us-house/headshots/512x512/tom-ohalleran.jpg"
"Arizona","arizona","AZ","az","2","false","false","M001197","2225","412611","N00033982","137299","H2AZ08102","2067","Q6774492","kg:/m/027fybv","representative","republican","Martha McSally","martha-mcsally","Martha",,"McSally",,,"MAR-thuh mik-SAL-ee","female","white-american","christian","no","1966-03-22","2015-01-06","2019-01-03","Martha McSally, a Representative from Arizona; born in Warwick, Kent County, R.I., March 22, 1966; B.S., United States Air Force Academy, Colorado Springs, Colo., 1988; M.P.P., John F. Kennedy School of Government, Harvard University, Cambridge, Mass., 1990; United States Air Force, 1988-2010; fighter pilot; professor; unsuccessful candidate for nomination for special election to the One Hundred Twelfth Congress in 2012; unsuccessful candidate for election to the One Hundred Thirteenth Congress in 2012; elected as a Republican to the One Hundred Fourteenth and to the succeeding Congress (January 3, 2015-present).","202-225-2542","202-225-0378","38.8863235","-77.011373","2436 Rayburn Hob, Washington, DC 20515","2436",,"Rayburn Hob",,,"Washington","DC","20515",,"https://mcsally.house.gov","https://mcsally.house.gov/contact","https://www.facebook.com/RepMcSally/","RepMcSally","https://twitter.com/RepMcSally","https://cdn.civil.services/us-house/headshots/512x512/martha-mcsally.jpg"
"Arizona","arizona","AZ","az","3","false","false","G000551","1708","400162","N00025284","28253","H2AZ07070","268","Q946606","kg:/m/024s1z","representative","democrat","Raul Grijalva","raul-grijalva","Raul",,"Grijalva",,,"rah-OOL gree-HAL-vuh [Rs are trilled]","male","hispanic-american","roman-catholic","no","1948-02-19","2003-01-07","2019-01-03","Raul Grijalva, a Representative from Arizona; born in Tucson, Pima County, Ariz., February 19, 1948; graduated from Sunnyside High School, Tucson, Ariz.; B.A., University of Arizona, Tucson, Ariz., 1986; member of the Tucson, Ariz., Unified School Board, 1974-1986; Pima County, Ariz. supervisor, 1989-2002; elected as a Democrat to the One Hundred Eighth and to the seven succeeding Congresses (January 3, 2003-present).","202-225-2435","202-225-1541","38.8863235","-77.011373","2436 Rayburn Hob, Washington, DC 20515","2436",,"Rayburn Hob",,,"Washington","DC","20515",,"https://grijalva.house.gov","https://grijalva.house.gov/email-raul","https://www.facebook.com/GrijalvaForCongress/","RepRaulGrijalva","https://twitter.com/RepRaulGrijalva","https://cdn.civil.services/us-house/headshots/512x512/raul-grijalva.jpg"
"Arizona","arizona","AZ","az","4","false","false","G000565","1992","412397","N00030771","123491","H0AZ01259","1411","Q2059832","kg:/m/0czdqz0","representative","republican","Paul Gosar","paul-gosar","Paul","A.","Gosar",,,"PAWL GOH-sar","male","white-american","roman-catholic","no","1958-11-22","2011-01-05","2019-01-03","Paul Gosar, a Representative from Arizona; born in Rock Springs, Sweetwater County, Wyo., November 22, 1958; graduated from Pinedale High School, Pinedale, Wyo., 1977; B.S., Creighton University, Omaha, Nebr., 1981; D.D.S., Creighton University, Omaha, Nebr., 1985; dentist; elected as a Republican to the One Hundred Twelfth and to the three succeeding Congresses (January 3, 2011-present).","202-225-2315",,"38.8863235","-77.011373","2436 Rayburn Hob, Washington, DC 20515","2436",,"Rayburn Hob",,,"Washington","DC","20515",,"https://paulgosar.house.gov","http://paulgosar.house.gov/contact/","https://www.facebook.com/repgosar/","RepGosar","https://twitter.com/RepGosar","https://cdn.civil.services/us-house/headshots/512x512/paul-gosar.jpg"
"Arizona","arizona","AZ","az","5","false","false","B001302",,"412683","N00039293","28088","H6AZ05083","2195","Q16199304",,"representative","republican","Andy Biggs","andy-biggs","Andy",,"Biggs",,,"ANN-dee BIGZ","male","white-american","mormon","no","1958-11-07","2017-01-03","2019-01-03","Andy Biggs, a Representative from Arizona; born in Tucson, Pima County, Ariz., November 7, 1958; B.A., Brigham Young University, Provo, Utah, 1982; J.D., University of Arizona, Tucson, Ariz., 1984; M.A., Arizona State University, Phoenix, Ariz, 1999; lawyer, private practice; member of the Arizona state house of representatives, 2003-2011; member of the Arizona state senate, 2011-2016, majority leader, 2011-2012, president, 2013-2016; elected as a Republican to the One Hundred Fifteenth Congress (January 3, 2017-present).","202-225-2635",,"38.8863235","-77.011373","2436 Rayburn Hob, Washington, DC 20515","2436",,"Rayburn Hob",,,"Washington","DC","20515",,"https://biggs.house.gov","https://biggs.house.gov/contact","https://www.facebook.com/RepAndyBiggs","RepAndyBiggsAZ","https://twitter.com/RepAndyBiggsAZ","https://cdn.civil.services/us-house/headshots/512x512/andy-biggs.jpg"
"Arizona","arizona","AZ","az","6","false","false","S001183","1994","412399","N00006460","106387","H4AZ06045","1413","Q1176561","kg:/m/03wbpxj","representative","republican","David Schweikert","david-schweikert","David",,"Schweikert",,,"DAY-vid SHWAHY-kert","male","white-american","roman-catholic","no","1962-03-03","2011-01-05","2019-01-03","David Schweikert, a Representative from Arizona; born in Los Angeles, Los Angeles County, Calif., on March 3, 1962; A.A., Scottsdale Community College, Scottsdale, Ariz., 1985; B.S., Arizona State University, Tempe, Ariz., 1988; M.B.A., Arizona State University, Tempe, Ariz., 2005; business owner; realtor; financial consultant; member of the Arizona state house of representatives, 1989-1994; member of the Arizona state board of equalization, 1995-2003; Maricopa County, Ariz. treasurer, 2004-2006; elected as a Republican to the One Hundred Twelfth and to the three succeeding Congresses (January 3, 2011-present).","202-225-2190","202-225-0096","38.8863235","-77.011373","2436 Rayburn Hob, Washington, DC 20515","2436",,"Rayburn Hob",,,"Washington","DC","20515",,"https://schweikert.house.gov","https://schweikert.house.gov/contact","https://www.facebook.com/repdavidschweikert/","RepDavid","https://twitter.com/RepDavid","https://cdn.civil.services/us-house/headshots/512x512/david-schweikert.jpg"
"Arizona","arizona","AZ","az","7","false","false","G000574","2226","412612","N00036097",,"H4AZ07043","2068","Q16218474","kg:/m/0wy0mz5","representative","democrat","Ruben Gallego","ruben-gallego","Ruben",,"Gallego",,,"ROO-bin GUY-ay-goh","male","hispanic-american","roman-catholic","no","1979-11-20","2015-01-06","2019-01-03","Ruben Gallego, a Representative from Arizona; born in Chicago, Cook County, Ill., November 20, 1979; A.B., Harvard University, Cambridge, Mass., 2004; United States Marine Corps, 2002-2006; public affairs consultant, 2007-2008; delegate, Democratic National Convention, 2008; vice-chair, Arizona Democratic party, 2009; member of the Arizona state house of representatives, 2010-2014, assistant minority leader, 2012-2014; elected as a Democrat to the One Hundred Fourteenth and to the succeeding Congress (January 3, 2015-present).","202-225-4065","602-257-9103","38.8863235","-77.011373","2436 Rayburn Hob, Washington, DC 20515","2436",,"Rayburn Hob",,,"Washington","DC","20515",,"https://rubengallego.house.gov","https://rubengallego.house.gov/contact","https://www.facebook.com/RepRubenGallego/","RepRubenGallego","https://twitter.com/RepRubenGallego","https://cdn.civil.services/us-house/headshots/512x512/ruben-gallego.jpg"
