state_name,state_name_slug,state_code,state_code_slug,district,at_large,vacant,bioguide,thomas,govtrack,opensecrets,votesmart,fec,maplight,wikidata,google_entity_id,title,party,name,name_slug,first_name,middle_name,last_name,name_suffix,goes_by,pronunciation,gender,ethnicity,religion,openly_lgbtq,date_of_birth,entered_office,term_end,biography,phone,fax,latitude,longitude,address_complete,address_number,address_prefix,address_street,address_sec_unit_type,address_sec_unit_num,address_city,address_state,address_zipcode,address_type,website,contact_page,facebook_url,twitter_handle,twitter_url,photo_url
"Georgia","georgia","GA","ga","1","false","false","C001103","2236","412622","N00035346","32085","H4GA01039","2078","Q16240994","kg:/m/0w32xj9","representative","republican","Buddy Carter","buddy-carter","Buddy",,"Carter",,,"BUH-dee CAR-ter","male","white-american","methodist","no","1957-09-06","2015-01-06","2019-01-03","Buddy Carter, a Representative from Georgia; born in Port Wentworth, Chatham County, Ga., September 6, 1957; graduated from Robert W. Groves High School, Garden City, Ga., 1975; A.A., Young Harris College, Young Harris, Ga., 1977; B.S., University of Georgia, Athens, Ga., 1980; pharmacist; business owner; member of the Pooler, Ga., city council, 1994-1995; Mayor of Pooler, Ga., 1996-2004; member of the Georgia state house of representatives, 2005-2009; member of the Georgia state senate, 2009-2014; elected as a Republican to the One Hundred Fourteenth and to the succeeding Congress (January 3, 2015-present).","202-225-5831","202-226-2269","38.8863235","-77.011373","2436 Rayburn Hob, Washington, DC 20515","2436",,"Rayburn Hob",,,"Washington","DC","20515",,"https://buddycarter.house.gov","http://buddycarter.house.gov/contact/","https://www.facebook.com/CongressmanBuddyCarter/","RepBuddyCarter","https://twitter.com/RepBuddyCarter","https://cdn.civil.services/us-house/headshots/512x512/buddy-carter.jpg"
"Georgia","georgia","GA","ga","2","false","false","B000490","91","400030","N00002674","26817","H2GA02031","148","Q983428","kg:/m/02554k","representative","democrat","Sanford Bishop","sanford-bishop","Sanford","D.","Bishop","Jr.",,"SAN-ferd BISH-up","male","african-american","baptist","no","1947-02-04","1993-01-05","2019-01-03","Sanford Bishop, a Representative from Georgia; born in Mobile, Mobile County, Ala., February 4, 1947; graduated from Central High School, Mobile, Ala., 1964; B.A., Morehouse College, Atlanta, Ga., 1968; J.D., Emory University, Atlanta, Ga., 1971; lawyer, private practice; United States Army, 1969-1971; member of the Georgia state house of representatives, 1977-1991; member of the Georgia state senate, 1991-1993; elected as a Democrat to the One Hundred Third and to the twelve succeeding Congresses (January 3, 1993-present).","202-225-3631","202-225-2203","38.8863235","-77.011373","2436 Rayburn Hob, Washington, DC 20515","2436",,"Rayburn Hob",,,"Washington","DC","20515",,"https://bishop.house.gov","https://bishop.house.gov/contact/email-me","https://www.facebook.com/sanfordbishop/","SanfordBishop","https://twitter.com/SanfordBishop","https://cdn.civil.services/us-house/headshots/512x512/sanford-bishop.jpg"
"Georgia","georgia","GA","ga","3","false","false","F000465",,"412700","N00039090","168132","H6GA03113","2212","Q26157659",,"representative","republican","Drew Ferguson","drew-ferguson","Drew","A.","Ferguson",,,"JROO FER-guh-suhn","male","white-american","unspecified","no","1967-11-15","2017-01-03","2019-01-03","Drew Ferguson, a Representative from Georgia; born in West Point, Troup County, Ga., November 15, 1967; graduated from Springwood School, Lanett, Ala., 1985; attended University of Georgia, Athens, Ga., 1988; D.M.D., Medical College of Georgia, Augusta, Ga., 1992; dentist; faculty, Medical College of Georgia, Augusta, Ga., 1998-2016; member of the West Point, Ga., board of aldermen, 1997-1999; Mayor of West Point, Ga., 2008-2016; elected as a Republican to the One Hundred Fifteenth Congress (January 3, 2017-present).","202-225-5901",,"38.8863235","-77.011373","2436 Rayburn Hob, Washington, DC 20515","2436",,"Rayburn Hob",,,"Washington","DC","20515",,"https://ferguson.house.gov","https://ferguson.house.gov/contact/email","https://www.facebook.com/drewfergusonforcongress/","DrewFergusonGA","https://twitter.com/DrewFergusonGA","https://cdn.civil.services/us-house/headshots/512x512/drew-ferguson.jpg"
"Georgia","georgia","GA","ga","4","false","false","J000288","1843","412199","N00027848","68070","H6GA04129","686","Q983537","kg:/m/0flgyy","representative","democrat","Henry Johnson","henry-johnson","Henry","C.","Johnson","Jr.","Hank","HAYNK JAHN-suhn","male","african-american","soka-gakkai-buddhist","no","1954-10-02","2007-01-04","2019-01-03","Henry Johnson, a Representative from Georgia; born in Washington, D.C., October 2, 1954; B.A., Clark College (Clark Atlanta University), Atlanta, Ga., 1976; J.D., Thurgood Marshall School of Law, Texas Southern University, Houston, Tex., 1979; lawyer, private practice; member of the DeKalb County, Ga., board of commissioners, 2001-2006; associate judge, DeKalb County, Ga., magistrate court, 1989-2001; one of the managers appointed by the House of Representatives in 2009 to conduct the impeachment proceedings of Samuel B. Kent, judge of the United States District Court for the Southern District of Texas; elected as a Democrat to the One Hundred Tenth and to the five succeeding Congresses (January 3, 2007-present).","202-225-1605","202-226-0691","38.8863235","-77.011373","2436 Rayburn Hob, Washington, DC 20515","2436",,"Rayburn Hob",,,"Washington","DC","20515",,"https://hankjohnson.house.gov","https://hankjohnson.house.gov/contact/email","https://www.facebook.com/RepHankJohnson/","RepHankJohnson","https://twitter.com/RepHankJohnson","https://cdn.civil.services/us-house/headshots/512x512/henry-johnson.jpg"
"Georgia","georgia","GA","ga","5","false","false","L000287","688","400240","N00002577","26820","H6GA05217","341","Q45380","kg:/m/02555z","representative","democrat","John Lewis","john-lewis","John",,"Lewis",,,"JAHN LOO-iss","male","african-american","baptist","no","1940-02-21","1987-01-06","2019-01-03","John Lewis, a Representative from Georgia; born in Troy, Pike County, Ala., February 21, 1940; attended Pike County Training School, Brundidge, Ala.; B.A., American Baptist Theological Seminary, Nashville, Tenn., 1961; B.A., Fisk University, Nashville, Tenn., 1967; chairman, Student Nonviolent Coordinating Committee, 1963-1966; director of ACTION, 1977-1980; community affairs director, National Consumer Co-op Bank, Atlanta, 1980-1986; member of the Atlanta, Ga., city council, 1982-1986; elected as a Democrat to the One Hundredth and to the fifteen succeeding Congresses (January 3, 1987-present).","202-225-3801",,"38.8863235","-77.011373","2436 Rayburn Hob, Washington, DC 20515","2436",,"Rayburn Hob",,,"Washington","DC","20515",,"https://johnlewis.house.gov","https://johnlewis.house.gov/contact-me/email","https://www.facebook.com/RepJohnLewis","repjohnlewis","https://twitter.com/repjohnlewis","https://cdn.civil.services/us-house/headshots/512x512/john-lewis.jpg"
"Georgia","georgia","GA","ga","6","false","false","H001078",,"412737","N00035477","69553","H8GA06286","2249","Q6369678",,"representative","republican","Karen Handel","karen-handel","Karen","Christine","Handel",,,"KA-ren HAN-del","female","white-american","roman-catholic","no","1962-04-18","2017-06-26","2019-01-03","Karen Handel, a Representative from Georgia; born in Washington, District of Columbia, April 18, 1962; graduated from Frederick Douglass High School, Upper Marlboro, Md., 1980; attended Prince Georges County Community College, Largo, Md.; attended University of Maryland University College, Adelphi, Md.; business executive; staff, Governor Sonny Perdue of Georgia, 2002-2003; chairwoman, Fulton County (Ga.) commission, 2003-2006; Secretary of State of Georgia, 2007-2009; unsuccessful candidate for nomination for Governor of Georgia in 2010; unsuccessful candidate for nomination to the United States Senate in 2014; elected as a Republican to the One Hundred Fifteenth Congress, by special election, to fill the vacancy caused by the resignation of United States Representative Tom Price (June 20, 2017-present).","202-225-4501",,"38.8863235","-77.011373","2436 Rayburn Hob, Washington, DC 20515","2436",,"Rayburn Hob",,,"Washington","DC","20515",,"https://handel.house.gov/","https://handel.house.gov/contact","https://www.facebook.com/handel.karen","karenhandel","https://twitter.com/karenhandel","https://cdn.civil.services/us-house/headshots/512x512/karen-handel.jpg"
"Georgia","georgia","GA","ga","7","false","false","W000810","2008","412416","N00032416","122251","H0GA07133","1428","Q2156128","kg:/m/0cz8ryh","representative","republican","Robert Woodall","robert-woodall","Robert",,"Woodall",,"Rob","RAHB WOOD-awl","male","white-american","methodist","no","1970-02-11","2011-01-05","2019-01-03","Robert Woodall, a Representative from Georgia; born in Athens, Clarke County, Ga., February 11, 1970; graduated from Marist School, Atlanta, Ga., 1988; B.A., Furman University, Greenville, S.C., 1992; J.D., University of Georgia, Athens, Ga., 1998; staff, United States Representative John Linder, 1994-2010; elected as a Republican to the One Hundred Twelfth and to the three succeeding Congresses (January 3, 2011-present).","202-225-4272","202-225-4696","38.8863235","-77.011373","2436 Rayburn Hob, Washington, DC 20515","2436",,"Rayburn Hob",,,"Washington","DC","20515",,"https://woodall.house.gov","https://woodall.house.gov/contact/email","https://www.facebook.com/RepRobWoodall","RepRobWoodall","https://twitter.com/RepRobWoodall","https://cdn.civil.services/us-house/headshots/512x512/robert-woodall.jpg"
"Georgia","georgia","GA","ga","8","false","false","S001189","2009","412417","N00032457","11812","H0GA08099","1429","Q781167","kg:/m/076zn3y","representative","republican","Austin Scott","austin-scott","Austin",,"Scott",,,"AW-stin SKAHT","male","white-american","southern-baptist","no","1969-12-10","2011-01-05","2019-01-03","Austin Scott, a Representative from Georgia; born in Augusta, Richmond County, Ga., December 10, 1969; B.B.A., University of Georgia, Athens, Ga., 1993; business owner; member of the Georgia state house of representatives, 1997-2010; elected as a Republican to the One Hundred Twelfth and to the three succeeding Congresses (January 3, 2011-present).","202-225-6531","202-225-3013","38.8863235","-77.011373","2436 Rayburn Hob, Washington, DC 20515","2436",,"Rayburn Hob",,,"Washington","DC","20515",,"https://austinscott.house.gov","https://austinscott.house.gov/contact/email","https://www.facebook.com/RepAustinScott/","AustinScottGA08","https://twitter.com/AustinScottGA08","https://cdn.civil.services/us-house/headshots/512x512/austin-scott.jpg"
"Georgia","georgia","GA","ga","9","false","false","C001093","2121","412531","N00033518","67851","H2GA09150","1755","Q3162841","kg:/m/0lq9rkz","representative","republican","Doug Collins","doug-collins","Doug",,"Collins",,,"DUHG KAH-linz","male","white-american","southern-baptist","no","1966-08-16","2013-01-03","2019-01-03","Doug Collins, a Representative from Georgia; born in Gainesville, Hall County, Ga., August 16, 1966; graduated from North Hall High School, Gainesville, Ga.; B.A., North Georgia College, Dahlonega, Ga., 1988; M.Div., New Orleans Theological Seminary, New Orleans, La., 1996; J.D., John Marshall Law School, Atlanta, Ga., 2008; United States Air Force Reserve, 2007-present; pastor; lawyer, private practice; businessman; member of the Georgia state house of representatives, 2007-2012; elected as a Republican to the One Hundred Thirteenth and to the two succeeding Congresses (January 3, 2013-present).","202-225-9893","202-226-1224","38.8863235","-77.011373","2436 Rayburn Hob, Washington, DC 20515","2436",,"Rayburn Hob",,,"Washington","DC","20515",,"https://dougcollins.house.gov","https://dougcollins.house.gov/email-me/","https://www.facebook.com/RepresentativeDougCollins/","RepDougCollins","https://twitter.com/RepDougCollins","https://cdn.civil.services/us-house/headshots/512x512/doug-collins.jpg"
"Georgia","georgia","GA","ga","10","false","false","H001071","2237","412623","N00032243","122246","H0GA07125","2079","Q6208081","kg:/m/0640dpx","representative","republican","Jody Hice","jody-hice","Jody",,"Hice",,,"JO-dee HICE","male","white-american","southern-baptist","no","1960-04-22","2015-01-06","2019-01-03","Jody Hice, a Representative from Georgia; born in Atlanta, Fulton County, Ga., April 22, 1960; graduated from Tucker High School, Tucker, Ga., 1978; B.A., Asbury College, Wilmore, Ky., 1982; M.Div., Southwestern Baptist Theological Seminary, Fort Worth, Tex., 1986; D.Min., Luther Rice University and Seminary, Lithonia, Ga., 1988; pastor; talk radio host; unsuccessful candidate for nomination to the One Hundred Thirteenth Congress in 2010; elected as a Republican to the One Hundred Fourteenth and to the two succeeding Congresses (January 3, 2015-present).","202-225-4101","202-226-0776","38.8863235","-77.011373","2436 Rayburn Hob, Washington, DC 20515","2436",,"Rayburn Hob",,,"Washington","DC","20515",,"https://hice.house.gov","https://hice.house.gov/contact/","https://www.facebook.com/CongressmanJodyHice/","CongressmanHice","https://twitter.com/CongressmanHice","https://cdn.civil.services/us-house/headshots/512x512/jody-hice.jpg"
"Georgia","georgia","GA","ga","11","false","false","L000583","2238","412624","N00035347","31618","H4GA11061","2080","Q16731643","kg:/m/0wqdmcm","representative","republican","Barry Loudermilk","barry-loudermilk","Barry",,"Loudermilk",,,"BAIR-ee LOUD-er-milk","male","white-american","baptist","no","1963-12-22","2015-01-06","2019-01-03","Barry Loudermilk, a Representative from Georgia; born in Riverdale, Clayton County, Ga., December 22, 1963; A.A., United States Air Force Community College, 1987; B.S., Wayland Baptist University, Plainview, Tex., 1992; United States Air Force, 1984-1992; chairman, Bartow County, Ga., Republican Party, 2001-2004; business owner; member of the Georgia state house of representatives, 2005-2010; member of the Georgia state senate, 2011-2013; elected as a Republican to the One Hundred Fourteenth and to the succeeding Congress (January 3, 2015-present).","202-225-2931","202-225-2944","38.8863235","-77.011373","2436 Rayburn Hob, Washington, DC 20515","2436",,"Rayburn Hob",,,"Washington","DC","20515",,"https://loudermilk.house.gov","http://www.loudermilk.house.gov/contact/","https://www.facebook.com/RepLoudermilk/","RepLoudermilk","https://twitter.com/RepLoudermilk","https://cdn.civil.services/us-house/headshots/512x512/barry-loudermilk.jpg"
"Georgia","georgia","GA","ga","12","false","false","A000372","2239","412625","N00033720","136062","H2GA12121","2081","Q18683976","kg:/m/0127y9dk","representative","republican","Rick Allen","rick-allen","Rick",,"Allen",,,"RIK AL-en","male","white-american","methodist","no","1951-11-07","2015-01-06","2019-01-03","Rick Allen, a Representative from Georgia; born in Augusta, Richmond County, Ga., November 7, 1951; graduated from Evans High School, Evans, Ga., 1969; B.S., Auburn University, Auburn, Ala., 1973; business owner; elected as a Republican to the One Hundred Fourteenth and to the succeeding Congress (January 3, 2015-present).","202-225-2823","202-225-3377","38.8863235","-77.011373","2436 Rayburn Hob, Washington, DC 20515","2436",,"Rayburn Hob",,,"Washington","DC","20515",,"https://allen.house.gov","http://allen.house.gov/contact/","https://www.facebook.com/CongressmanRickAllen/","RepRickAllen","https://twitter.com/RepRickAllen","https://cdn.civil.services/us-house/headshots/512x512/rick-allen.jpg"
"Georgia","georgia","GA","ga","13","false","false","S001157","1722","400363","N00024871","7826","H2GA13012","454","Q132071","kg:/m/0255r4","representative","democrat","David Scott","david-scott","David",,"Scott",,,"DAY-vid SKAHT","male","african-american","baptist","no","1945-06-27","2003-01-07","2019-01-03","David Scott, a Representative from Georgia; born in Aynor, Horry County, S.C., June 27, 1945; graduated from Campbell High School, Daytona Beach, Fla., 1963; B.A., Florida Agricultural and Mechanical University, Tallahassee, Fla., 1967; M.B.A., Wharton School of Finance, University of Pennsylvania, Philadelphia, Pa., 1969; business owner; member of the Georgia state house of representatives, 1974-1982; member of the Georgia state senate, 1982-2002; elected as a Democrat to the One Hundred Eighth and to the seven succeeding Congresses (January 3, 2003-present).","202-225-2939","202-225-4628","38.8863235","-77.011373","2436 Rayburn Hob, Washington, DC 20515","2436",,"Rayburn Hob",,,"Washington","DC","20515",,"https://davidscott.house.gov","https://davidscott.house.gov/contact/contactform.htm","https://www.facebook.com/RepDavidScott/","repdavidscott","https://twitter.com/repdavidscott","https://cdn.civil.services/us-house/headshots/512x512/david-scott.jpg"
"Georgia","georgia","GA","ga","14","false","false","G000560","1979","412388","N00030788","31969","H0GA09030","1369","Q1647301","kg:/m/0c02hpl","representative","republican","Tom Graves","tom-graves","Tom",,"Graves",,,"TAHM GRAYVZ","male","white-american","southern-baptist","no","1970-02-03","2010-06-08","2019-01-03","Tom Graves, a Representative from Georgia; born in St. Petersburg, Pinellas County, Fla., February 3, 1970; graduated from Cass High School, Cartersville, Ga., 1988; B.B.A., University of Georgia, Athens, Ga., 1993; business owner; member of the Georgia state house of representatives, 2003-2010; elected as a Republican to the One Hundred Eleventh Congress, by special election, to fill the vacancy caused by the resignation of United States Representative John Nathan Deal, and to the four succeeding Congresses (June 8, 2010-present).","202-225-5211","202-225-8272","38.8863235","-77.011373","2436 Rayburn Hob, Washington, DC 20515","2436",,"Rayburn Hob",,,"Washington","DC","20515",,"https://tomgraves.house.gov","http://tomgraves.house.gov/contact/","https://www.facebook.com/reptomgraves/","RepTomGraves","https://twitter.com/RepTomGraves","https://cdn.civil.services/us-house/headshots/512x512/tom-graves.jpg"
"Hawaii","hawaii","HI","hi","1","false","false","H001050","2010","412418","N00025881","17745","H2HI02110","1430","Q276359","kg:/m/03cwzgv","representative","democrat","Colleen Hanabusa","colleen-hanabusa","Colleen",,"Hanabusa",,,"kuh-LEEN hah-nuh-BOO-suh","female","asian-american","jodo-shinshu-buddhist","no","1951-05-04","2011-01-05","2019-01-03","Colleen Hanabusa, a Representative from Hawaii; born in Honolulu, Honolulu County, Hawaii, May 4, 1951; graduated from St. Andrew's Priory School, Honolulu, Hawaii, 1969; B.A., University of Hawaii, Manoa, Hawaii, 1973; M.A., University of Hawaii, Manoa, Hawaii, 1975; J.D., University of Hawaii, Manoa, Hawaii, 1977; lawyer, private practice; member of the Hawaii state senate, 1998-2010, president, 2007-2010; unsuccessful candidate for nomination to the United States House of Representatives in 2006; elected as a Democrat to the One Hundred Twelfth and to the succeeding Congress (January 3, 2011-January 3, 2015); was not a candidate for reelection to the One Hundred Fourteenth Congress in 2014, but was an unsuccessful candidate for nomination to the United States Senate; lawyer, private practice; elected simultaneously as a Democrat to the One Hundred Fourteenth and the One Hundred Fifteenth Congresses, by special election, to fill the vacancy caused by the death of United States Representative Mark Takai (November 8, 2016-present).","202-225-2726","202-225-0688","38.8863235","-77.011373","2436 Rayburn Hob, Washington, DC 20515","2436",,"Rayburn Hob",,,"Washington","DC","20515",,"https://hanabusa.house.gov","https://hanabusa.house.gov/contact/email","https://www.facebook.com/RepColleenHanabusa/",,,"https://cdn.civil.services/us-house/headshots/512x512/colleen-hanabusa.jpg"
"Hawaii","hawaii","HI","hi","2","false","false","G000571","2122","412532","N00033281","129306","H2HI02508","1756","Q32620","kg:/m/0cnyrfq","representative","democrat","Tulsi Gabbard","tulsi-gabbard","Tulsi",,"Gabbard",,,"TUHL-si GAB-erd","female","pacific-islander","hindu","no","1981-04-12","2013-01-03","2019-01-03","Tulsi Gabbard, a Representative from Hawaii; born in Leloaloa, American Samoa, April 12, 1981; B.S.B.A., Hawaii Pacific University, Honolulu, Hawaii, 2009; member of the Hawaii state house of representatives, 2002-2004; Hawaii Army National Guard, 2003-present; staff, Senator Daniel Kahikina Akaka of Hawaii; member of the Honolulu, Hawaii, city council, 2010-2012; elected as a Democrat to the One Hundred Thirteenth and to the two succeeding Congresses (January 3, 2013-present).","202-225-4906","202-225-4987","38.8863235","-77.011373","2436 Rayburn Hob, Washington, DC 20515","2436",,"Rayburn Hob",,,"Washington","DC","20515",,"https://gabbard.house.gov","https://gabbard.house.gov/connect/share-your-ideas","https://www.facebook.com/RepTulsiGabbard/","TulsiGabbard","https://twitter.com/TulsiGabbard","https://cdn.civil.services/us-house/headshots/512x512/tulsi-gabbard.jpg"
"Iowa","iowa","IA","ia","1","false","false","B001294","2241","412627","N00033744",,"H2IA01055","2083","Q18684853","kg:/m/0127p02j","representative","republican","Rod Blum","rod-blum","Rod",,"Blum",,,"RAHD BLUHM","male","white-american","episcopalian","no","1955-04-26","2015-01-06","2019-01-03","Rod Blum, a Representative from Iowa; born in Dubuque, Dubuque County, Iowa, April 26, 1955; graduated from Dubuque Senior High School, Dubuque, Iowa, 1973; B.A., Loras College, Dubuque, Iowa, 1977; M.B.A., University of Dubuque, Dubuque, Iowa, 1989; business executive; unsuccessful candidate for nomination to the One Hundred Thirteenth Congress in 2012; elected as a Republican to the One Hundred Fourteenth and to the succeeding Congress (January 3, 2015-present).","202-225-2911","319-364-2994","38.8863235","-77.011373","2436 Rayburn Hob, Washington, DC 20515","2436",,"Rayburn Hob",,,"Washington","DC","20515",,"https://blum.house.gov","https://blum.house.gov/contact/email","https://www.facebook.com/congressmanrodblum/","RepRodBlum","https://twitter.com/RepRodBlum","https://cdn.civil.services/us-house/headshots/512x512/rod-blum.jpg"
"Iowa","iowa","IA","ia","2","false","false","L000565","1846","412209","N00027741","68964","H6IA02146","694","Q771586","kg:/m/0gtmqs","representative","democrat","David Loebsack","david-loebsack","David",,"Loebsack",,"Dave","DAVE LOHB-sack","male","white-american","methodist","no","1952-12-23","2007-01-04","2019-01-03","David Loebsack, a Representative from Iowa; born in Sioux City, Woodbury County, Iowa, December 23, 1952; graduated from East High School, Sioux City, Iowa, 1970; B.S., Iowa State University, Ames, Iowa, 1974; M.A., Iowa State University, Ames, Iowa, 1976; Ph.D., University of California, Davis, Calif., 1985; professor, Cornell College, Mount Vernon, Iowa; elected as a Democrat to the One Hundred Tenth and to the five succeeding Congresses (January 3, 2007-present).","202-225-6576","202-226-0757","38.8863235","-77.011373","2436 Rayburn Hob, Washington, DC 20515","2436",,"Rayburn Hob",,,"Washington","DC","20515",,"https://loebsack.house.gov","https://loebsack.house.gov/forms/writeyourrep/","https://www.facebook.com/DaveLoebsack","daveloebsack","https://twitter.com/daveloebsack","https://cdn.civil.services/us-house/headshots/512x512/david-loebsack.jpg"
"Iowa","iowa","IA","ia","3","false","false","Y000066","2242","412628","N00035509",,"S4IA00103","2084","Q19321008","kg:/m/0127pc92","representative","republican","David Young","david-young","David",,"Young",,,"DAY-vid YUHNG","male","white-american","lutheran","no","1968-05-11","2015-01-06","2019-01-03","David Young, a Representative from Iowa; born in Van Meter, Dallas County, Iowa, May 11, 1968; graduated from Johnston High School, Johnston, Iowa, 1986; B.A., Drake University, Des Moines, Iowa, 1991; businessman; staff, United States Senator George Hanks (Hank) Brown of Colorado, 1993-1996; staff, campaign manager, United States Senator James Paul David Bunning of Kentucky, 1998-2006; chief of staff, United States Senator Charles Ernest Grassley of Iowa, 2006-2013; elected as a Republican to the One Hundred Fourteenth and to the succeeding Congress (January 3, 2015-present).","202-225-5476",,"38.8863235","-77.011373","2436 Rayburn Hob, Washington, DC 20515","2436",,"Rayburn Hob",,,"Washington","DC","20515",,"https://davidyoung.house.gov","https://davidyoung.house.gov/contact/email","https://www.facebook.com/RepDavidYoung/","RepDavidYoung","https://twitter.com/RepDavidYoung","https://cdn.civil.services/us-house/headshots/512x512/david-young.jpg"
"Iowa","iowa","IA","ia","4","false","false","K000362","1724","400220","N00025237","10853","H2IA05072","320","Q749710","kg:/m/025b7g","representative","republican","Steve King","steve-king","Steve",,"King",,,"STEEV KING","male","white-american","roman-catholic","no","1949-05-28","2003-01-07","2019-01-03","Steve King, a Representative from Iowa; born in Storm Lake, Buena Vista County, Iowa, May 28, 1949; graduated from Denison Community High School, Denison, Iowa; attended Northwest Missouri State University, Maryville, Mo., 1967-1970; business owner; member of the Iowa state senate, 1996-2002; elected as a Republican to the One Hundred Eighth and to the seven succeeding Congresses (January 3, 2003-present).","202-225-4426","202.225.3193","38.8863235","-77.011373","2436 Rayburn Hob, Washington, DC 20515","2436",,"Rayburn Hob",,,"Washington","DC","20515",,"https://steveking.house.gov","https://steveking.house.gov/contact","https://www.facebook.com/SteveKingIA/","SteveKingIA","https://twitter.com/SteveKingIA","https://cdn.civil.services/us-house/headshots/512x512/steve-king.jpg"
